auto_scheduler/prelu.json
{"i": [["[\"prelu\", 128, 3, 229, 229, \"float32\"]", "cuda -keys=cuda,gpu -max_num_threads=1024 -thread_warp_size=32", [-1, 16, 64, 49152, 65536, 1024, 8, 32]], [[], [["FU", 2, [0, 1, 2, 3]], ["SP", 2, 0, 20137344, [64], 1], ["AN", 2, 0, 5], ["AN", 2, 1, 6]]]], "r": [[0.000442403], 0, 1.97633, 1607330277], "v": "v0.3"}
{"i": [["[\"prelu\", 128, 3, 229, 229, \"float32\"]", "cuda -keys=cuda,gpu -max_num_threads=1024 -thread_warp_size=32", [-1, 16, 64, 49152, 65536, 1024, 8, 32]], [[], [["FU", 2, [0, 1, 2, 3]], ["SP", 2, 0, 20137344, [6], 1], ["AN", 2, 0, 5], ["AN", 2, 1, 6]]]], "r": [[0.00456961], 0, 1.62756, 1607330279], "v": "v0.3"}
{"i": [["[\"prelu\", 128, 3, 229, 229, \"float32\"]", "cuda -keys=cuda,gpu -max_num_threads=1024 -thread_warp_size=32", [-1, 16, 64, 49152, 65536, 1024, 8, 32]], [[], [["FU", 2, [0, 1, 2, 3]], ["SP", 2, 0, 20137344, [48], 1], ["AN", 2, 0, 5], ["AN", 2, 1, 6]]]], "r": [[0.000575805], 0, 2.10526, 1607330280], "v": "v0.3"}
{"i": [["[\"prelu\", 128, 3, 229, 229, \"float32\"]", "cuda -keys=cuda,gpu -max_num_threads=1024 -thread_warp_size=32", [-1, 16, 64, 49152, 65536, 1024, 8, 32]], [[], [["FU", 2, [0, 1, 2, 3]], ["SP", 2, 0, 20137344, [3], 1], ["AN", 2, 0, 5], ["AN", 2, 1, 6]]]], "r": [[0.00918258], 0, 1.62326, 1607330282], "v": "v0.3"}
{"i": [["[\"prelu\", 128, 3, 229, 229, \"float32\"]", "cuda -keys=cuda,gpu -max_num_threads=1024 -thread_warp_size=32", [-1, 16, 64, 49152, 65536, 1024, 8, 32]], [[], [["FU", 2, [0, 1, 2, 3]], ["SP", 2, 0, 20137344, [8], 1], ["AN", 2, 0, 5], ["AN", 2, 1, 6]]]], "r": [[0.00344268], 0, 1.63033, 1607330283], "v": "v0.3"}
{"i": [["[\"prelu\", 128, 3, 229, 229, \"float32\"]", "cuda -keys=cuda,gpu -max_num_threads=1024 -thread_warp_size=32", [-1, 16, 64, 49152, 65536, 1024, 8, 32]], [[], [["FU", 2, [0, 1, 2, 3]], ["SP", 2, 0, 20137344, [1], 1], ["AN", 2, 0, 5], ["AN", 2, 1, 6]]]], "r": [[0.0275582], 0, 1.67548, 1607330284], "v": "v0.3"}
{"i": [["[\"prelu\", 128, 3, 229, 229, \"float32\"]", "cuda -keys=cuda,gpu -max_num_threads=1024 -thread_warp_size=32", [-1, 16, 64, 49152, 65536, 1024, 8, 32]], [[], [["FU", 2, [0, 1, 2, 3]], ["SP", 2, 0, 20137344, [2], 1], ["AN", 2, 0, 5], ["AN", 2, 1, 6]]]], "r": [[0.0137772], 0, 1.73426, 1607330286], "v": "v0.3"}
{"i": [["[\"prelu\", 128, 3, 229, 229, \"float32\"]", "cuda -keys=cuda,gpu -max_num_threads=1024 -thread_warp_size=32", [-1, 16, 64, 49152, 65536, 1024, 8, 32]], [[], [["FU", 2, [0, 1, 2, 3]], ["SP", 2, 0, 20137344, [4], 1], ["AN", 2, 0, 5], ["AN", 2, 1, 6]]]], "r": [[0.00688588], 0, 1.58961, 1607330287], "v": "v0.3"}
{"i": [["[\"prelu\", 128, 3, 229, 229, \"float32\"]", "cuda -keys=cuda,gpu -max_num_threads=1024 -thread_warp_size=32", [-1, 16, 64, 49152, 65536, 1024, 8, 32]], [[], [["FU", 2, [0, 1, 2, 3]], ["SP", 2, 0, 20137344, [24], 1], ["AN", 2, 0, 5], ["AN", 2, 1, 6]]]], "r": [[0.00115004], 0, 1.58106, 1607330288], "v": "v0.3"}
{"i": [["[\"prelu\", 128, 3, 229, 229, \"float32\"]", "cuda -keys=cuda,gpu -max_num_threads=1024 -thread_warp_size=32", [-1, 16, 64, 49152, 65536, 1024, 8, 32]], [[], [["FU", 2, [0, 1, 2, 3]], ["SP", 2, 0, 20137344, [16], 1], ["AN", 2, 0, 5], ["AN", 2, 1, 6]]]], "r": [[0.00172323], 0, 2.10692, 1607330290], "v": "v0.3"}
{"i": [["[\"prelu\", 128, 3, 229, 229, \"float32\"]", "cuda -keys=cuda,gpu -max_num_threads=1024 -thread_warp_size=32", [-1, 16, 64, 49152, 65536, 1024, 8, 32]], [[], [["FU", 2, [0, 1, 2, 3]], ["SP", 2, 0, 20137344, [12], 1], ["AN", 2, 0, 5], ["AN", 2, 1, 6]]]], "r": [[0.00229643], 0, 1.59298, 1607330291], "v": "v0.3"}
{"i": [["[\"prelu\", 128, 3, 229, 229, \"float32\"]", "cuda -keys=cuda,gpu -max_num_threads=1024 -thread_warp_size=32", [-1, 16, 64, 49152, 65536, 1024, 8, 32]], [[], [["FU", 2, [0, 1, 2, 3]], ["SP", 2, 0, 20137344, [32], 1], ["AN", 2, 0, 5], ["AN", 2, 1, 6]]]], "r": [[0.000863759], 0, 2.10721, 1607330293], "v": "v0.3"}
{"i": [["[\"prelu\", 128, 3, 229, 229, \"float32\"]", "cuda -keys=cuda,gpu -max_num_threads=1024 -thread_warp_size=32", [-1, 16, 64, 49152, 65536, 1024, 8, 32]], [[], [["FU", 2, [0, 1, 2, 3]], ["SP", 2, 0, 20137344, [16], 1], ["AN", 2, 0, 5], ["AN", 2, 1, 6]]]], "r": [[0.00177704], 0, 1.92117, 1607331385], "v": "v0.3"}
{"i": [["[\"prelu\", 128, 3, 229, 229, \"float32\"]", "cuda -keys=cuda,gpu -max_num_threads=1024 -thread_warp_size=32", [-1, 16, 64, 49152, 65536, 1024, 8, 32]], [[], [["FU", 2, [0, 1, 2, 3]], ["SP", 2, 0, 20137344, [4], 1], ["AN", 2, 0, 5], ["AN", 2, 1, 6]]]], "r": [[0.0068852], 0, 1.60363, 1607331386], "v": "v0.3"}
{"i": [["[\"prelu\", 128, 3, 229, 229, \"float32\"]", "cuda -keys=cuda,gpu -max_num_threads=1024 -thread_warp_size=32", [-1, 16, 64, 49152, 65536, 1024, 8, 32]], [[], [["FU", 2, [0, 1, 2, 3]], ["SP", 2, 0, 20137344, [24], 1], ["AN", 2, 0, 5], ["AN", 2, 1, 6]]]], "r": [[0.00114981], 0, 1.57397, 1607331387], "v": "v0.3"}
{"i": [["[\"prelu\", 128, 3, 229, 229, \"float32\"]", "cuda -keys=cuda,gpu -max_num_threads=1024 -thread_warp_size=32", [-1, 16, 64, 49152, 65536, 1024, 8, 32]], [[], [["FU", 2, [0, 1, 2, 3]], ["SP", 2, 0, 20137344, [48], 1], ["AN", 2, 0, 5], ["AN", 2, 1, 6]]]], "r": [[0.000575789], 0, 2.06085, 1607331389], "v": "v0.3"}
{"i": [["[\"prelu\", 128, 3, 229, 229, \"float32\"]", "cuda -keys=cuda,gpu -max_num_threads=1024 -thread_warp_size=32", [-1, 16, 64, 49152, 65536, 1024, 8, 32]], [[], [["FU", 2, [0, 1, 2, 3]], ["SP", 2, 0, 20137344, [32], 1], ["AN", 2, 0, 5], ["AN", 2, 1, 6]]]], "r": [[0.000863665], 0, 2.10979, 1607331391], "v": "v0.3"}
{"i": [["[\"prelu\", 128, 3, 229, 229, \"float32\"]", "cuda -keys=cuda,gpu -max_num_threads=1024 -thread_warp_size=32", [-1, 16, 64, 49152, 65536, 1024, 8, 32]], [[], [["FU", 2, [0, 1, 2, 3]], ["SP", 2, 0, 20137344, [12], 1], ["AN", 2, 0, 5], ["AN", 2, 1, 6]]]], "r": [[0.00229645], 0, 1.56917, 1607331392], "v": "v0.3"}
{"i": [["[\"prelu\", 128, 3, 229, 229, \"float32\"]", "cuda -keys=cuda,gpu -max_num_threads=1024 -thread_warp_size=32", [-1, 16, 64, 49152, 65536, 1024, 8, 32]], [[], [["FU", 2, [0, 1, 2, 3]], ["SP", 2, 0, 20137344, [6], 1], ["AN", 2, 0, 5], ["AN", 2, 1, 6]]]], "r": [[0.00458948], 0, 1.55524, 1607331394], "v": "v0.3"}
{"i": [["[\"prelu\", 128, 3, 229, 229, \"float32\"]", "cuda -keys=cuda,gpu -max_num_threads=1024 -thread_warp_size=32", [-1, 16, 64, 49152, 65536, 1024, 8, 32]], [[], [["FU", 2, [0, 1, 2, 3]], ["SP", 2, 0, 20137344, [3], 1], ["AN", 2, 0, 5], ["AN", 2, 1, 6]]]], "r": [[0.00918143], 0, 1.59478, 1607331395], "v": "v0.3"}
{"i": [["[\"prelu\", 128, 3, 229, 229, \"float32\"]", "cuda -keys=cuda,gpu -max_num_threads=1024 -thread_warp_size=32", [-1, 16, 64, 49152, 65536, 1024, 8, 32]], [[], [["FU", 2, [0, 1, 2, 3]], ["SP", 2, 0, 20137344, [64], 1], ["AN", 2, 0, 5], ["AN", 2, 1, 6]]]], "r": [[0.0004327], 0, 2.01736, 1607331397], "v": "v0.3"}
{"i": [["[\"prelu\", 128, 3, 229, 229, \"float32\"]", "cuda -keys=cuda,gpu -max_num_threads=1024 -thread_warp_size=32", [-1, 16, 64, 49152, 65536, 1024, 8, 32]], [[], [["FU", 2, [0, 1, 2, 3]], ["SP", 2, 0, 20137344, [2], 1], ["AN", 2, 0, 5], ["AN", 2, 1, 6]]]], "r": [[0.0137779], 0, 1.62215, 1607331398], "v": "v0.3"}
{"i": [["[\"prelu\", 128, 3, 229, 229, \"float32\"]", "cuda -keys=cuda,gpu -max_num_threads=1024 -thread_warp_size=32", [-1, 16, 64, 49152, 65536, 1024, 8, 32]], [[], [["FU", 2, [0, 1, 2, 3]], ["SP", 2, 0, 20137344, [1], 1], ["AN", 2, 0, 5], ["AN", 2, 1, 6]]]], "r": [[0.0275566], 0, 1.63962, 1607331399], "v": "v0.3"}
{"i": [["[\"prelu\", 128, 3, 229, 229, \"float32\"]", "cuda -keys=cuda,gpu -max_num_threads=1024 -thread_warp_size=32", [-1, 16, 64, 49152, 65536, 1024, 8, 32]], [[], [["FU", 2, [0, 1, 2, 3]], ["SP", 2, 0, 20137344, [8], 1], ["AN", 2, 0, 5], ["AN", 2, 1, 6]]]], "r": [[0.00344355], 0, 1.59689, 1607331400], "v": "v0.3"}
{"i": [["[\"prelu\", 128, 30, 229, 229, \"float32\"]", "cuda -keys=cuda,gpu -max_num_threads=1024 -thread_warp_size=32", [-1, 16, 64, 49152, 65536, 1024, 8, 32]], [[], [["FU", 2, [0, 1, 2, 3]], ["SP", 2, 0, 201373440, [48], 1], ["AN", 2, 0, 5], ["AN", 2, 1, 6]]]], "r": [[0.00590698], 0, 7.2447, 1607332979], "v": "v0.3"}
{"i": [["[\"prelu\", 128, 30, 229, 229, \"float32\"]", "cuda -keys=cuda,gpu -max_num_threads=1024 -thread_warp_size=32", [-1, 16, 64, 49152, 65536, 1024, 8, 32]], [[], [["FU", 2, [0, 1, 2, 3]], ["SP", 2, 0, 201373440, [2], 1], ["AN", 2, 0, 5], ["AN", 2, 1, 6]]]], "r": [[0.149868], 0, 7.5898, 1607332986], "v": "v0.3"}
{"i": [["[\"prelu\", 128, 30, 229, 229, \"float32\"]", "cuda -keys=cuda,gpu -max_num_threads=1024 -thread_warp_size=32", [-1, 16, 64, 49152, 65536, 1024, 8, 32]], [[], [["FU", 2, [0, 1, 2, 3]], ["SP", 2, 0, 201373440, [5], 1], ["AN", 2, 0, 5], ["AN", 2, 1, 6]]]], "r": [[0.0550646], 0, 7.07735, 1607332992], "v": "v0.3"}
{"i": [["[\"prelu\", 128, 30, 229, 229, \"float32\"]", "cuda -keys=cuda,gpu -max_num_threads=1024 -thread_warp_size=32", [-1, 16, 64, 49152, 65536, 1024, 8, 32]], [[], [["FU", 2, [0, 1, 2, 3]], ["SP", 2, 0, 201373440, [20], 1], ["AN", 2, 0, 5], ["AN", 2, 1, 6]]]], "r": [[0.0137858], 0, 7.4902, 1607333000], "v": "v0.3"}
{"i": [["[\"prelu\", 128, 30, 229, 229, \"float32\"]", "cuda -keys=cuda,gpu -max_num_threads=1024 -thread_warp_size=32", [-1, 16, 64, 49152, 65536, 1024, 8, 32]], [[], [["FU", 2, [0, 1, 2, 3]], ["SP", 2, 0, 201373440, [4], 1], ["AN", 2, 0, 5], ["AN", 2, 1, 6]]]], "r": [[0.0688612], 0, 7.40137, 1607333007], "v": "v0.3"}
{"i": [["[\"prelu\", 128, 30, 229, 229, \"float32\"]", "cuda -keys=cuda,gpu -max_num_threads=1024 -thread_warp_size=32", [-1, 16, 64, 49152, 65536, 1024, 8, 32]], [[], [["FU", 2, [0, 1, 2, 3]], ["SP", 2, 0, 201373440, [16], 1], ["AN", 2, 0, 5], ["AN", 2, 1, 6]]]], "r": [[0.0172203], 0, 7.1386, 1607333013], "v": "v0.3"}
{"i": [["[\"prelu\", 128, 30, 229, 229, \"float32\"]", "cuda -keys=cuda,gpu -max_num_threads=1024 -thread_warp_size=32", [-1, 16, 64, 49152, 65536, 1024, 8, 32]], [[], [["FU", 2, [0, 1, 2, 3]], ["SP", 2, 0, 201373440, [24], 1], ["AN", 2, 0, 5], ["AN", 2, 1, 6]]]], "r": [[0.0114882], 0, 6.8849, 1607333020], "v": "v0.3"}
{"i": [["[\"prelu\", 128, 30, 229, 229, \"float32\"]", "cuda -keys=cuda,gpu -max_num_threads=1024 -thread_warp_size=32", [-1, 16, 64, 49152, 65536, 1024, 8, 32]], [[], [["FU", 2, [0, 1, 2, 3]], ["SP", 2, 0, 201373440, [3], 1], ["AN", 2, 0, 5], ["AN", 2, 1, 6]]]], "r": [[0.0918142], 0, 7.76106, 1607333027], "v": "v0.3"}
{"i": [["[\"prelu\", 128, 30, 229, 229, \"float32\"]", "cuda -keys=cuda,gpu -max_num_threads=1024 -thread_warp_size=32", [-1, 16, 64, 49152, 65536, 1024, 8, 32]], [[], [["FU", 2, [0, 1, 2, 3]], ["SP", 2, 0, 201373440, [60], 1], ["AN", 2, 0, 5], ["AN", 2, 1, 6]]]], "r": [[0.0047351], 0, 7.31041, 1607333034], "v": "v0.3"}
{"i": [["[\"prelu\", 128, 30, 229, 229, \"float32\"]", "cuda -keys=cuda,gpu -max_num_threads=1024 -thread_warp_size=32", [-1, 16, 64, 49152, 65536, 1024, 8, 32]], [[], [["FU", 2, [0, 1, 2, 3]], ["SP", 2, 0, 201373440, [10], 1], ["AN", 2, 0, 5], ["AN", 2, 1, 6]]]], "r": [[0.0275379], 0, 7.52496, 1607333041], "v": "v0.3"}
{"i": [["[\"prelu\", 128, 30, 229, 229, \"float32\"]", "cuda -keys=cuda,gpu -max_num_threads=1024 -thread_warp_size=32", [-1, 16, 64, 49152, 65536, 1024, 8, 32]], [[], [["FU", 2, [0, 1, 2, 3]], ["SP", 2, 0, 201373440, [15], 1], ["AN", 2, 0, 5], ["AN", 2, 1, 6]]]], "r": [[0.0183714], 0, 6.88571, 1607333048], "v": "v0.3"}
{"i": [["[\"prelu\", 128, 30, 229, 229, \"float32\"]", "cuda -keys=cuda,gpu -max_num_threads=1024 -thread_warp_size=32", [-1, 16, 64, 49152, 65536, 1024, 8, 32]], [[], [["FU", 2, [0, 1, 2, 3]], ["SP", 2, 0, 201373440, [8], 1], ["AN", 2, 0, 5], ["AN", 2, 1, 6]]]], "r": [[0.03461], 0, 7.58125, 1607333055], "v": "v0.3"}
{"i": [["[\"prelu\", 128, 30, 229, 229, \"float32\"]", "cuda -keys=cuda,gpu -max_num_threads=1024 -thread_warp_size=32", [-1, 16, 64, 49152, 65536, 1024, 8, 32]], [[], [["FU", 2, [0, 1, 2, 3]], ["SP", 2, 0, 201373440, [32], 1], ["AN", 2, 0, 5], ["AN", 2, 1, 6]]]], "r": [[0.00868159], 0, 6.82477, 1607333061], "v": "v0.3"}
{"i": [["[\"prelu\", 128, 30, 229, 229, \"float32\"]", "cuda -keys=cuda,gpu -max_num_threads=1024 -thread_warp_size=32", [-1, 16, 64, 49152, 65536, 1024, 8, 32]], [[], [["FU", 2, [0, 1, 2, 3]], ["SP", 2, 0, 201373440, [40], 1], ["AN", 2, 0, 5], ["AN", 2, 1, 6]]]], "r": [[0.00693211], 0, 7.29306, 1607333068], "v": "v0.3"}
{"i": [["[\"prelu\", 128, 30, 229, 229, \"float32\"]", "cuda -keys=cuda,gpu -max_num_threads=1024 -thread_warp_size=32", [-1, 16, 64, 49152, 65536, 1024, 8, 32]], [[], [["FU", 2, [0, 1, 2, 3]], ["SP", 2, 0, 201373440, [64], 1], ["AN", 2, 0, 5], ["AN", 2, 1, 6]]]], "r": [[0.00433609], 0, 6.85184, 1607333075], "v": "v0.3"}
{"i": [["[\"prelu\", 128, 30, 229, 229, \"float32\"]", "cuda -keys=cuda,gpu -max_num_threads=1024 -thread_warp_size=32", [-1, 16, 64, 49152, 65536, 1024, 8, 32]], [[], [["FU", 2, [0, 1, 2, 3]], ["SP", 2, 0, 201373440, [6], 1], ["AN", 2, 0, 5], ["AN", 2, 1, 6]]]], "r": [[0.0461394], 0, 7.92162, 1607333082], "v": "v0.3"}
{"i": [["[\"prelu\", 128, 30, 229, 229, \"float32\"]", "cuda -keys=cuda,gpu -max_num_threads=1024 -thread_warp_size=32", [-1, 16, 64, 49152, 65536, 1024, 8, 32]], [[], [["FU", 2, [0, 1, 2, 3]], ["SP", 2, 0, 201373440, [30], 1], ["AN", 2, 0, 5], ["AN", 2, 1, 6]]]], "r": [[0.00925253], 0, 7.01789, 1607333089], "v": "v0.3"}
{"i": [["[\"prelu\", 128, 30, 229, 229, \"float32\"]", "cuda -keys=cuda,gpu -max_num_threads=1024 -thread_warp_size=32", [-1, 16, 64, 49152, 65536, 1024, 8, 32]], [[], [["FU", 2, [0, 1, 2, 3]], ["SP", 2, 0, 201373440, [1], 1], ["AN", 2, 0, 5], ["AN", 2, 1, 6]]]], "r": [[0.276927], 0, 7.97592, 1607333097], "v": "v0.3"}
{"i": [["[\"prelu\", 128, 30, 229, 229, \"float32\"]", "cuda -keys=cuda,gpu -max_num_threads=1024 -thread_warp_size=32", [-1, 16, 64, 49152, 65536, 1024, 8, 32]], [[], [["FU", 2, [0, 1, 2, 3]], ["SP", 2, 0, 201373440, [12], 1], ["AN", 2, 0, 5], ["AN", 2, 1, 6]]]], "r": [[0.0231008], 0, 6.93439, 1607333103], "v": "v0.3"}
