auto_scheduler/sepconv.json
{"i": [["[\"sepconv\", 2, 5, 5, 4, 3, 3, 3, \"float32\"]", "cuda -keys=cuda,gpu -max_num_threads=1024 -thread_warp_size=32", [-1, 16, 64, 49152, 65536, 1024, 8, 32]], [[], [["CHW", 6, "local"], ["SP", 6, 0, 2, [1, 2, 1, 1], 1], ["SP", 6, 5, 4, [1, 2, 1, 2], 1], ["SP", 6, 10, 3, [1, 3, 1, 1], 1], ["SP", 6, 15, 3, [1, 1, 3, 1], 1], ["SP", 6, 20, 3, [1, 1], 1], ["SP", 6, 23, 1, [1, 1], 1], ["SP", 6, 26, 1, [1, 1], 1], ["RE", 6, [0, 5, 10, 15, 1, 6, 11, 16, 2, 7, 12, 17, 20, 23, 26, 21, 24, 27, 3, 8, 13, 18, 22, 25, 28, 4, 9, 14, 19]], ["FSP", 7, 0, 1, 3], ["FSP", 7, 4, 2, 3], ["FSP", 7, 8, 3, 3], ["FSP", 7, 12, 4, 3], ["RE", 7, [0, 4, 8, 12, 1, 5, 9, 13, 2, 6, 10, 14, 3, 7, 11, 15]], ["CA", 6, 7, 11], ["CHR", 5, "shared", [6]], ["CA", 6, 7, 14], ["CHR", 4, "shared", [7]], ["CA", 5, 8, 14], ["CI", 4], ["CHW", 3, "local"], ["SP", 3, 0, 2, [1, 2, 1, 1], 1], ["SP", 3, 5, 3, [1, 3, 1, 1], 1], ["SP", 3, 10, 3, [1, 1, 1, 3], 1], ["SP", 3, 15, 3, [1, 3, 1, 1], 1], ["SP", 3, 20, 1, [1, 1], 1], ["SP", 3, 23, 3, [1, 3], 1], ["SP", 3, 26, 3, [1, 3], 1], ["RE", 3, [0, 5, 10, 15, 1, 6, 11, 16, 2, 7, 12, 17, 20, 23, 26, 21, 24, 27, 3, 8, 13, 18, 22, 25, 28, 4, 9, 14, 19]], ["FSP", 4, 0, 21, 3], ["FSP", 4, 4, 22, 3], ["FSP", 4, 8, 23, 3], ["FSP", 4, 12, 24, 3], ["RE", 4, [0, 4, 8, 12, 1, 5, 9, 13, 2, 6, 10, 14, 3, 7, 11, 15]], ["CA", 3, 4, 11], ["CHR", 2, "shared", [3]], ["CA", 3, 4, 14], ["CHR", 1, "shared", [4]], ["CA", 2, 5, 14], ["CI", 1], ["FU", 12, [0, 1, 2, 3]], ["AN", 12, 0, 5], ["FU", 12, [1, 2, 3, 4]], ["AN", 12, 1, 4], ["FU", 12, [2, 3, 4, 5]], ["AN", 12, 2, 6], ["FU", 10, [0, 1, 2, 3]], ["SP", 10, 0, 2, [1], 1], ["AN", 10, 1, 2], ["FFSP", 10, 0, [4, 3, 2, 1], 1, 1], ["AN", 10, 1, 6], ["FU", 8, [0, 1, 2, 3]], ["SP", 8, 0, 1, [1], 1], ["AN", 8, 1, 2], ["FFSP", 8, 0, [4, 3, 2, 1], 1, 1], ["AN", 8, 1, 6], ["FU", 6, [0, 1, 2, 3]], ["AN", 6, 0, 5], ["FU", 6, [1, 2, 3, 4]], ["AN", 6, 1, 4], ["FU", 6, [2, 3, 4, 5]], ["AN", 6, 2, 6], ["FU", 4, [0, 1, 2, 3]], ["SP", 4, 0, 9, [1], 1], ["AN", 4, 1, 2], ["FFSP", 4, 0, [24, 23, 22, 21], 1, 1], ["AN", 4, 1, 6], ["FU", 2, [0, 1, 2, 3]], ["SP", 2, 0, 9, [9], 1], ["AN", 2, 1, 2], ["FFSP", 2, 0, [24, 23, 22, 21], 1, 1], ["AN", 2, 1, 6], ["PR", 5, 0, "auto_unroll_max_step$0"], ["PR", 11, 0, "auto_unroll_max_step$0"]]]], "r": [[4.84725e-06], 0, 1.89152, 1607392411], "v": "v0.3"}
{"i": [["[\"sepconv\", 2, 5, 5, 4, 3, 3, 3, \"float32\"]", "cuda -keys=cuda,gpu -max_num_threads=1024 -thread_warp_size=32", [-1, 16, 64, 49152, 65536, 1024, 8, 32]], [[], [["CHW", 6, "local"], ["SP", 6, 0, 2, [1, 2, 1, 1], 1], ["SP", 6, 5, 4, [1, 2, 1, 2], 1], ["SP", 6, 10, 3, [1, 3, 1, 1], 1], ["SP", 6, 15, 3, [1, 3, 1, 1], 1], ["SP", 6, 20, 3, [1, 1], 1], ["SP", 6, 23, 1, [1, 1], 1], ["SP", 6, 26, 1, [1, 1], 1], ["RE", 6, [0, 5, 10, 15, 1, 6, 11, 16, 2, 7, 12, 17, 20, 23, 26, 21, 24, 27, 3, 8, 13, 18, 22, 25, 28, 4, 9, 14, 19]], ["FSP", 7, 0, 1, 3], ["FSP", 7, 4, 2, 3], ["FSP", 7, 8, 3, 3], ["FSP", 7, 12, 4, 3], ["RE", 7, [0, 4, 8, 12, 1, 5, 9, 13, 2, 6, 10, 14, 3, 7, 11, 15]], ["CA", 6, 7, 11], ["CHR", 5, "shared", [6]], ["CA", 6, 7, 14], ["CHR", 4, "shared", [7]], ["CA", 5, 8, 14], ["CI", 4], ["CHW", 3, "local"], ["SP", 3, 0, 2, [1, 2, 1, 1], 1], ["SP", 3, 5, 3, [1, 3, 1, 1], 1], ["SP", 3, 10, 3, [1, 3, 1, 1], 1], ["SP", 3, 15, 3, [1, 3, 1, 1], 1], ["SP", 3, 20, 1, [1, 1], 1], ["SP", 3, 23, 3, [1, 3], 1], ["SP", 3, 26, 3, [1, 3], 1], ["RE", 3, [0, 5, 10, 15, 1, 6, 11, 16, 2, 7, 12, 17, 20, 23, 26, 21, 24, 27, 3, 8, 13, 18, 22, 25, 28, 4, 9, 14, 19]], ["FSP", 4, 0, 21, 3], ["FSP", 4, 4, 22, 3], ["FSP", 4, 8, 23, 3], ["FSP", 4, 12, 24, 3], ["RE", 4, [0, 4, 8, 12, 1, 5, 9, 13, 2, 6, 10, 14, 3, 7, 11, 15]], ["CA", 3, 4, 11], ["CHR", 2, "shared", [3]], ["CA", 3, 4, 14], ["CHR", 1, "shared", [4]], ["CA", 2, 5, 14], ["CI", 1], ["FU", 12, [0, 1, 2, 3]], ["AN", 12, 0, 5], ["FU", 12, [1, 2, 3, 4]], ["AN", 12, 1, 4], ["FU", 12, [2, 3, 4, 5]], ["AN", 12, 2, 6], ["FU", 10, [0, 1, 2, 3]], ["SP", 10, 0, 2, [1], 1], ["AN", 10, 1, 2], ["FFSP", 10, 0, [4, 3, 2, 1], 1, 1], ["AN", 10, 1, 6], ["FU", 8, [0, 1, 2, 3]], ["SP", 8, 0, 1, [1], 1], ["AN", 8, 1, 2], ["FFSP", 8, 0, [4, 3, 2, 1], 1, 1], ["AN", 8, 1, 6], ["FU", 6, [0, 1, 2, 3]], ["AN", 6, 0, 5], ["FU", 6, [1, 2, 3, 4]], ["AN", 6, 1, 4], ["FU", 6, [2, 3, 4, 5]], ["AN", 6, 2, 6], ["FU", 4, [0, 1, 2, 3]], ["SP", 4, 0, 9, [1], 1], ["AN", 4, 1, 2], ["FFSP", 4, 0, [24, 23, 22, 21], 1, 1], ["AN", 4, 1, 6], ["FU", 2, [0, 1, 2, 3]], ["SP", 2, 0, 9, [1], 1], ["AN", 2, 1, 2], ["FFSP", 2, 0, [24, 23, 22, 21], 1, 1], ["AN", 2, 1, 6], ["PR", 5, 0, "auto_unroll_max_step$64"], ["PR", 11, 0, "auto_unroll_max_step$16"]]]], "r": [[5.08365e-06], 0, 2.07787, 1607392413], "v": "v0.3"}
{"i": [["[\"sepconv\", 2, 5, 5, 4, 3, 3, 3, \"float32\"]", "cuda -keys=cuda,gpu -max_num_threads=1024 -thread_warp_size=32", [-1, 16, 64, 49152, 65536, 1024, 8, 32]], [[], [["CHW", 6, "local"], ["SP", 6, 0, 2, [1, 2, 1, 1], 1], ["SP", 6, 5, 4, [1, 2, 1, 2], 1], ["SP", 6, 10, 3, [1, 3, 1, 1], 1], ["SP", 6, 15, 3, [1, 1, 3, 1], 1], ["SP", 6, 20, 3, [1, 3], 1], ["SP", 6, 23, 1, [1, 1], 1], ["SP", 6, 26, 1, [1, 1], 1], ["RE", 6, [0, 5, 10, 15, 1, 6, 11, 16, 2, 7, 12, 17, 20, 23, 26, 21, 24, 27, 3, 8, 13, 18, 22, 25, 28, 4, 9, 14, 19]], ["FSP", 7, 0, 1, 3], ["FSP", 7, 4, 2, 3], ["FSP", 7, 8, 3, 3], ["FSP", 7, 12, 4, 3], ["RE", 7, [0, 4, 8, 12, 1, 5, 9, 13, 2, 6, 10, 14, 3, 7, 11, 15]], ["CA", 6, 7, 11], ["CHR", 5, "shared", [6]], ["CA", 6, 7, 14], ["CHR", 4, "shared", [7]], ["CA", 5, 8, 14], ["CI", 4], ["CHW", 3, "local"], ["SP", 3, 0, 2, [1, 2, 1, 1], 1], ["SP", 3, 5, 3, [1, 1, 3, 1], 1], ["SP", 3, 10, 3, [1, 3, 1, 1], 1], ["SP", 3, 15, 3, [1, 3, 1, 1], 1], ["SP", 3, 20, 1, [1, 1], 1], ["SP", 3, 23, 3, [1, 3], 1], ["SP", 3, 26, 3, [1, 3], 1], ["RE", 3, [0, 5, 10, 15, 1, 6, 11, 16, 2, 7, 12, 17, 20, 23, 26, 21, 24, 27, 3, 8, 13, 18, 22, 25, 28, 4, 9, 14, 19]], ["FSP", 4, 0, 21, 3], ["FSP", 4, 4, 22, 3], ["FSP", 4, 8, 23, 3], ["FSP", 4, 12, 24, 3], ["RE", 4, [0, 4, 8, 12, 1, 5, 9, 13, 2, 6, 10, 14, 3, 7, 11, 15]], ["CA", 3, 4, 11], ["CHR", 2, "shared", [3]], ["CA", 3, 4, 14], ["CHR", 1, "shared", [4]], ["CA", 2, 5, 14], ["CI", 1], ["FU", 12, [0, 1, 2, 3]], ["AN", 12, 0, 5], ["FU", 12, [1, 2, 3, 4]], ["AN", 12, 1, 4], ["FU", 12, [2, 3, 4, 5]], ["AN", 12, 2, 6], ["FU", 10, [0, 1, 2, 3]], ["SP", 10, 0, 2, [1], 1], ["AN", 10, 1, 2], ["FFSP", 10, 0, [4, 3, 2, 1], 1, 1], ["AN", 10, 1, 6], ["FU", 8, [0, 1, 2, 3]], ["SP", 8, 0, 1, [1], 1], ["AN", 8, 1, 2], ["FFSP", 8, 0, [4, 3, 2, 1], 1, 1], ["AN", 8, 1, 6], ["FU", 6, [0, 1, 2, 3]], ["AN", 6, 0, 5], ["FU", 6, [1, 2, 3, 4]], ["AN", 6, 1, 4], ["FU", 6, [2, 3, 4, 5]], ["AN", 6, 2, 6], ["FU", 4, [0, 1, 2, 3]], ["SP", 4, 0, 9, [1], 1], ["AN", 4, 1, 2], ["FFSP", 4, 0, [24, 23, 22, 21], 1, 1], ["AN", 4, 1, 6], ["FU", 2, [0, 1, 2, 3]], ["SP", 2, 0, 9, [1], 1], ["AN", 2, 1, 2], ["FFSP", 2, 0, [24, 23, 22, 21], 1, 1], ["AN", 2, 1, 6], ["PR", 5, 0, "auto_unroll_max_step$64"], ["PR", 11, 0, "auto_unroll_max_step$64"]]]], "r": [[4.88509e-06], 0, 1.62704, 1607392414], "v": "v0.3"}
{"i": [["[\"sepconv\", 2, 5, 5, 4, 3, 3, 3, \"float32\"]", "cuda -keys=cuda,gpu -max_num_threads=1024 -thread_warp_size=32", [-1, 16, 64, 49152, 65536, 1024, 8, 32]], [[], [["CHW", 6, "local"], ["SP", 6, 0, 2, [1, 2, 1, 1], 1], ["SP", 6, 5, 4, [1, 2, 1, 2], 1], ["SP", 6, 10, 3, [1, 1, 1, 3], 1], ["SP", 6, 15, 3, [1, 3, 1, 1], 1], ["SP", 6, 20, 3, [1, 1], 1], ["SP", 6, 23, 1, [1, 1], 1], ["SP", 6, 26, 1, [1, 1], 1], ["RE", 6, [0, 5, 10, 15, 1, 6, 11, 16, 2, 7, 12, 17, 20, 23, 26, 21, 24, 27, 3, 8, 13, 18, 22, 25, 28, 4, 9, 14, 19]], ["FSP", 7, 0, 1, 3], ["FSP", 7, 4, 2, 3], ["FSP", 7, 8, 3, 3], ["FSP", 7, 12, 4, 3], ["RE", 7, [0, 4, 8, 12, 1, 5, 9, 13, 2, 6, 10, 14, 3, 7, 11, 15]], ["CA", 6, 7, 11], ["CHR", 5, "shared", [6]], ["CA", 6, 7, 14], ["CHR", 4, "shared", [7]], ["CA", 5, 8, 14], ["CI", 4], ["CHW", 3, "local"], ["SP", 3, 0, 2, [1, 2, 1, 1], 1], ["SP", 3, 5, 3, [1, 3, 1, 1], 1], ["SP", 3, 10, 3, [1, 3, 1, 1], 1], ["SP", 3, 15, 3, [1, 3, 1, 1], 1], ["SP", 3, 20, 1, [1, 1], 1], ["SP", 3, 23, 3, [1, 3], 1], ["SP", 3, 26, 3, [1, 3], 1], ["RE", 3, [0, 5, 10, 15, 1, 6, 11, 16, 2, 7, 12, 17, 20, 23, 26, 21, 24, 27, 3, 8, 13, 18, 22, 25, 28, 4, 9, 14, 19]], ["FSP", 4, 0, 21, 3], ["FSP", 4, 4, 22, 3], ["FSP", 4, 8, 23, 3], ["FSP", 4, 12, 24, 3], ["RE", 4, [0, 4, 8, 12, 1, 5, 9, 13, 2, 6, 10, 14, 3, 7, 11, 15]], ["CA", 3, 4, 11], ["CHR", 2, "shared", [3]], ["CA", 3, 4, 14], ["CHR", 1, "shared", [4]], ["CA", 2, 5, 14], ["CI", 1], ["FU", 12, [0, 1, 2, 3]], ["AN", 12, 0, 5], ["FU", 12, [1, 2, 3, 4]], ["AN", 12, 1, 4], ["FU", 12, [2, 3, 4, 5]], ["AN", 12, 2, 6], ["FU", 10, [0, 1, 2, 3]], ["SP", 10, 0, 2, [1], 1], ["AN", 10, 1, 2], ["FFSP", 10, 0, [4, 3, 2, 1], 1, 1], ["AN", 10, 1, 6], ["FU", 8, [0, 1, 2, 3]], ["SP", 8, 0, 1, [1], 1], ["AN", 8, 1, 2], ["FFSP", 8, 0, [4, 3, 2, 1], 1, 1], ["AN", 8, 1, 6], ["FU", 6, [0, 1, 2, 3]], ["AN", 6, 0, 5], ["FU", 6, [1, 2, 3, 4]], ["AN", 6, 1, 4], ["FU", 6, [2, 3, 4, 5]], ["AN", 6, 2, 6], ["FU", 4, [0, 1, 2, 3]], ["SP", 4, 0, 9, [1], 1], ["AN", 4, 1, 2], ["FFSP", 4, 0, [24, 23, 22, 21], 1, 1], ["AN", 4, 1, 6], ["FU", 2, [0, 1, 2, 3]], ["SP", 2, 0, 9, [1], 1], ["AN", 2, 1, 2], ["FFSP", 2, 0, [24, 23, 22, 21], 1, 1], ["AN", 2, 1, 6], ["PR", 5, 0, "auto_unroll_max_step$64"], ["PR", 11, 0, "auto_unroll_max_step$64"]]]], "r": [[5.06373e-06], 0, 2.07974, 1607392415], "v": "v0.3"}
{"i": [["[\"sepconv\", 2, 5, 5, 4, 3, 3, 3, \"float32\"]", "cuda -keys=cuda,gpu -max_num_threads=1024 -thread_warp_size=32", [-1, 16, 64, 49152, 65536, 1024, 8, 32]], [[], [["CHW", 6, "local"], ["SP", 6, 0, 2, [1, 2, 1, 1], 1], ["SP", 6, 5, 4, [1, 2, 1, 2], 1], ["SP", 6, 10, 3, [1, 3, 1, 1], 1], ["SP", 6, 15, 3, [1, 3, 1, 1], 1], ["SP", 6, 20, 3, [1, 3], 1], ["SP", 6, 23, 1, [1, 1], 1], ["SP", 6, 26, 1, [1, 1], 1], ["RE", 6, [0, 5, 10, 15, 1, 6, 11, 16, 2, 7, 12, 17, 20, 23, 26, 21, 24, 27, 3, 8, 13, 18, 22, 25, 28, 4, 9, 14, 19]], ["FSP", 7, 0, 1, 3], ["FSP", 7, 4, 2, 3], ["FSP", 7, 8, 3, 3], ["FSP", 7, 12, 4, 3], ["RE", 7, [0, 4, 8, 12, 1, 5, 9, 13, 2, 6, 10, 14, 3, 7, 11, 15]], ["CA", 6, 7, 11], ["CHR", 5, "shared", [6]], ["CA", 6, 7, 14], ["CHR", 4, "shared", [7]], ["CA", 5, 8, 14], ["CI", 4], ["CHW", 3, "local"], ["SP", 3, 0, 2, [1, 2, 1, 1], 1], ["SP", 3, 5, 3, [1, 1, 1, 1], 1], ["SP", 3, 10, 3, [3, 1, 1, 1], 1], ["SP", 3, 15, 3, [1, 1, 1, 1], 1], ["SP", 3, 20, 1, [1, 1], 1], ["SP", 3, 23, 3, [3, 1], 1], ["SP", 3, 26, 3, [1, 3], 1], ["RE", 3, [0, 5, 10, 15, 1, 6, 11, 16, 2, 7, 12, 17, 20, 23, 26, 21, 24, 27, 3, 8, 13, 18, 22, 25, 28, 4, 9, 14, 19]], ["FSP", 4, 0, 21, 3], ["FSP", 4, 4, 22, 3], ["FSP", 4, 8, 23, 3], ["FSP", 4, 12, 24, 3], ["RE", 4, [0, 4, 8, 12, 1, 5, 9, 13, 2, 6, 10, 14, 3, 7, 11, 15]], ["CA", 3, 4, 11], ["CHR", 2, "shared", [3]], ["CA", 3, 4, 14], ["CHR", 1, "shared", [4]], ["CA", 2, 5, 14], ["CI", 1], ["FU", 12, [0, 1, 2, 3]], ["AN", 12, 0, 5], ["FU", 12, [1, 2, 3, 4]], ["AN", 12, 1, 4], ["FU", 12, [2, 3, 4, 5]], ["AN", 12, 2, 6], ["FU", 10, [0, 1, 2, 3]], ["SP", 10, 0, 2, [2], 1], ["AN", 10, 1, 2], ["FFSP", 10, 0, [4, 3, 2, 1], 1, 1], ["AN", 10, 1, 6], ["FU", 8, [0, 1, 2, 3]], ["SP", 8, 0, 1, [1], 1], ["AN", 8, 1, 2], ["FFSP", 8, 0, [4, 3, 2, 1], 1, 1], ["AN", 8, 1, 6], ["FU", 6, [0, 1, 2, 3]], ["AN", 6, 0, 5], ["FU", 6, [1, 2, 3, 4]], ["AN", 6, 1, 4], ["FU", 6, [2, 3, 4, 5]], ["AN", 6, 2, 6], ["FU", 4, [0, 1, 2, 3]], ["SP", 4, 0, 9, [1], 1], ["AN", 4, 1, 2], ["FFSP", 4, 0, [24, 23, 22, 21], 1, 1], ["AN", 4, 1, 6], ["FU", 2, [0, 1, 2, 3]], ["SP", 2, 0, 9, [1], 1], ["AN", 2, 1, 2], ["FFSP", 2, 0, [24, 23, 22, 21], 1, 1], ["AN", 2, 1, 6], ["PR", 5, 0, "auto_unroll_max_step$64"], ["PR", 11, 0, "auto_unroll_max_step$16"]]]], "r": [[5.11557e-06], 0, 2.03524, 1607392417], "v": "v0.3"}
{"i": [["[\"sepconv\", 2, 5, 5, 4, 3, 3, 3, \"float32\"]", "cuda -keys=cuda,gpu -max_num_threads=1024 -thread_warp_size=32", [-1, 16, 64, 49152, 65536, 1024, 8, 32]], [[], [["CHW", 6, "local"], ["SP", 6, 0, 2, [1, 2, 1, 1], 1], ["SP", 6, 5, 4, [1, 1, 1, 2], 1], ["SP", 6, 10, 3, [1, 3, 1, 1], 1], ["SP", 6, 15, 3, [1, 3, 1, 1], 1], ["SP", 6, 20, 3, [3, 1], 1], ["SP", 6, 23, 1, [1, 1], 1], ["SP", 6, 26, 1, [1, 1], 1], ["RE", 6, [0, 5, 10, 15, 1, 6, 11, 16, 2, 7, 12, 17, 20, 23, 26, 21, 24, 27, 3, 8, 13, 18, 22, 25, 28, 4, 9, 14, 19]], ["FSP", 7, 0, 1, 3], ["FSP", 7, 4, 2, 3], ["FSP", 7, 8, 3, 3], ["FSP", 7, 12, 4, 3], ["RE", 7, [0, 4, 8, 12, 1, 5, 9, 13, 2, 6, 10, 14, 3, 7, 11, 15]], ["CA", 6, 7, 11], ["CHR", 5, "shared", [6]], ["CA", 6, 7, 14], ["CHR", 4, "shared", [7]], ["CA", 5, 8, 14], ["CI", 4], ["CHW", 3, "local"], ["SP", 3, 0, 2, [1, 2, 1, 1], 1], ["SP", 3, 5, 3, [1, 3, 1, 1], 1], ["SP", 3, 10, 3, [1, 3, 1, 1], 1], ["SP", 3, 15, 3, [1, 3, 1, 1], 1], ["SP", 3, 20, 1, [1, 1], 1], ["SP", 3, 23, 3, [1, 3], 1], ["SP", 3, 26, 3, [1, 1], 1], ["RE", 3, [0, 5, 10, 15, 1, 6, 11, 16, 2, 7, 12, 17, 20, 23, 26, 21, 24, 27, 3, 8, 13, 18, 22, 25, 28, 4, 9, 14, 19]], ["FSP", 4, 0, 21, 3], ["FSP", 4, 4, 22, 3], ["FSP", 4, 8, 23, 3], ["FSP", 4, 12, 24, 3], ["RE", 4, [0, 4, 8, 12, 1, 5, 9, 13, 2, 6, 10, 14, 3, 7, 11, 15]], ["CA", 3, 4, 11], ["CHR", 2, "shared", [3]], ["CA", 3, 4, 14], ["CHR", 1, "shared", [4]], ["CA", 2, 5, 14], ["CI", 1], ["FU", 12, [0, 1, 2, 3]], ["AN", 12, 0, 5], ["FU", 12, [1, 2, 3, 4]], ["AN", 12, 1, 4], ["FU", 12, [2, 3, 4, 5]], ["AN", 12, 2, 6], ["FU", 10, [0, 1, 2, 3]], ["SP", 10, 0, 2, [2], 1], ["AN", 10, 1, 2], ["FFSP", 10, 0, [4, 3, 2, 1], 1, 1], ["AN", 10, 1, 6], ["FU", 8, [0, 1, 2, 3]], ["SP", 8, 0, 1, [1], 1], ["AN", 8, 1, 2], ["FFSP", 8, 0, [4, 3, 2, 1], 1, 1], ["AN", 8, 1, 6], ["FU", 6, [0, 1, 2, 3]], ["AN", 6, 0, 5], ["FU", 6, [1, 2, 3, 4]], ["AN", 6, 1, 4], ["FU", 6, [2, 3, 4, 5]], ["AN", 6, 2, 6], ["FU", 4, [0, 1, 2, 3]], ["SP", 4, 0, 9, [1], 1], ["AN", 4, 1, 2], ["FFSP", 4, 0, [24, 23, 22, 21], 1, 1], ["AN", 4, 1, 6], ["FU", 2, [0, 1, 2, 3]], ["SP", 2, 0, 9, [1], 1], ["AN", 2, 1, 2], ["FFSP", 2, 0, [24, 23, 22, 21], 1, 1], ["AN", 2, 1, 6], ["PR", 5, 0, "auto_unroll_max_step$64"], ["PR", 11, 0, "auto_unroll_max_step$0"]]]], "r": [[5.24504e-06], 0, 1.51166, 1607392418], "v": "v0.3"}
{"i": [["[\"sepconv\", 2, 5, 5, 4, 3, 3, 3, \"float32\"]", "cuda -keys=cuda,gpu -max_num_threads=1024 -thread_warp_size=32", [-1, 16, 64, 49152, 65536, 1024, 8, 32]], [[], [["CHW", 6, "local"], ["SP", 6, 0, 2, [1, 2, 1, 1], 1], ["SP", 6, 5, 4, [1, 1, 2, 2], 1], ["SP", 6, 10, 3, [3, 1, 1, 1], 1], ["SP", 6, 15, 3, [1, 3, 1, 1], 1], ["SP", 6, 20, 3, [1, 1], 1], ["SP", 6, 23, 1, [1, 1], 1], ["SP", 6, 26, 1, [1, 1], 1], ["RE", 6, [0, 5, 10, 15, 1, 6, 11, 16, 2, 7, 12, 17, 20, 23, 26, 21, 24, 27, 3, 8, 13, 18, 22, 25, 28, 4, 9, 14, 19]], ["FSP", 7, 0, 1, 3], ["FSP", 7, 4, 2, 3], ["FSP", 7, 8, 3, 3], ["FSP", 7, 12, 4, 3], ["RE", 7, [0, 4, 8, 12, 1, 5, 9, 13, 2, 6, 10, 14, 3, 7, 11, 15]], ["CA", 6, 7, 11], ["CHR", 5, "shared", [6]], ["CA", 6, 7, 14], ["CHR", 4, "shared", [7]], ["CA", 5, 8, 14], ["CI", 4], ["CHW", 3, "local"], ["SP", 3, 0, 2, [1, 2, 1, 1], 1], ["SP", 3, 5, 3, [1, 3, 1, 1], 1], ["SP", 3, 10, 3, [1, 3, 1, 1], 1], ["SP", 3, 15, 3, [1, 3, 1, 1], 1], ["SP", 3, 20, 1, [1, 1], 1], ["SP", 3, 23, 3, [1, 3], 1], ["SP", 3, 26, 3, [1, 3], 1], ["RE", 3, [0, 5, 10, 15, 1, 6, 11, 16, 2, 7, 12, 17, 20, 23, 26, 21, 24, 27, 3, 8, 13, 18, 22, 25, 28, 4, 9, 14, 19]], ["FSP", 4, 0, 21, 3], ["FSP", 4, 4, 22, 3], ["FSP", 4, 8, 23, 3], ["FSP", 4, 12, 24, 3], ["RE", 4, [0, 4, 8, 12, 1, 5, 9, 13, 2, 6, 10, 14, 3, 7, 11, 15]], ["CA", 3, 4, 11], ["CHR", 2, "shared", [3]], ["CA", 3, 4, 14], ["CHR", 1, "shared", [4]], ["CA", 2, 5, 14], ["CI", 1], ["FU", 12, [0, 1, 2, 3]], ["AN", 12, 0, 5], ["FU", 12, [1, 2, 3, 4]], ["AN", 12, 1, 4], ["FU", 12, [2, 3, 4, 5]], ["AN", 12, 2, 6], ["FU", 10, [0, 1, 2, 3]], ["SP", 10, 0, 2, [1], 1], ["AN", 10, 1, 2], ["FFSP", 10, 0, [4, 3, 2, 1], 1, 1], ["AN", 10, 1, 6], ["FU", 8, [0, 1, 2, 3]], ["SP", 8, 0, 1, [1], 1], ["AN", 8, 1, 2], ["FFSP", 8, 0, [4, 3, 2, 1], 1, 1], ["AN", 8, 1, 6], ["FU", 6, [0, 1, 2, 3]], ["AN", 6, 0, 5], ["FU", 6, [1, 2, 3, 4]], ["AN", 6, 1, 4], ["FU", 6, [2, 3, 4, 5]], ["AN", 6, 2, 6], ["FU", 4, [0, 1, 2, 3]], ["SP", 4, 0, 9, [1], 1], ["AN", 4, 1, 2], ["FFSP", 4, 0, [24, 23, 22, 21], 1, 1], ["AN", 4, 1, 6], ["FU", 2, [0, 1, 2, 3]], ["SP", 2, 0, 9, [1], 1], ["AN", 2, 1, 2], ["FFSP", 2, 0, [24, 23, 22, 21], 1, 1], ["AN", 2, 1, 6], ["PR", 5, 0, "auto_unroll_max_step$64"], ["PR", 11, 0, "auto_unroll_max_step$0"]]]], "r": [[5.287e-06], 0, 1.51052, 1607392419], "v": "v0.3"}
{"i": [["[\"sepconv\", 2, 5, 5, 4, 3, 3, 3, \"float32\"]", "cuda -keys=cuda,gpu -max_num_threads=1024 -thread_warp_size=32", [-1, 16, 64, 49152, 65536, 1024, 8, 32]], [[], [["CHW", 6, "local"], ["SP", 6, 0, 2, [1, 2, 1, 1], 1], ["SP", 6, 5, 4, [1, 2, 1, 2], 1], ["SP", 6, 10, 3, [1, 3, 1, 1], 1], ["SP", 6, 15, 3, [1, 1, 1, 3], 1], ["SP", 6, 20, 3, [1, 1], 1], ["SP", 6, 23, 1, [1, 1], 1], ["SP", 6, 26, 1, [1, 1], 1], ["RE", 6, [0, 5, 10, 15, 1, 6, 11, 16, 2, 7, 12, 17, 20, 23, 26, 21, 24, 27, 3, 8, 13, 18, 22, 25, 28, 4, 9, 14, 19]], ["FSP", 7, 0, 1, 3], ["FSP", 7, 4, 2, 3], ["FSP", 7, 8, 3, 3], ["FSP", 7, 12, 4, 3], ["RE", 7, [0, 4, 8, 12, 1, 5, 9, 13, 2, 6, 10, 14, 3, 7, 11, 15]], ["CA", 6, 7, 11], ["CHR", 5, "shared", [6]], ["CA", 6, 7, 14], ["CHR", 4, "shared", [7]], ["CA", 5, 8, 14], ["CI", 4], ["CHW", 3, "local"], ["SP", 3, 0, 2, [1, 2, 1, 1], 1], ["SP", 3, 5, 3, [1, 3, 1, 1], 1], ["SP", 3, 10, 3, [1, 3, 1, 1], 1], ["SP", 3, 15, 3, [1, 1, 1, 1], 1], ["SP", 3, 20, 1, [1, 1], 1], ["SP", 3, 23, 3, [1, 1], 1], ["SP", 3, 26, 3, [1, 3], 1], ["RE", 3, [0, 5, 10, 15, 1, 6, 11, 16, 2, 7, 12, 17, 20, 23, 26, 21, 24, 27, 3, 8, 13, 18, 22, 25, 28, 4, 9, 14, 19]], ["FSP", 4, 0, 21, 3], ["FSP", 4, 4, 22, 3], ["FSP", 4, 8, 23, 3], ["FSP", 4, 12, 24, 3], ["RE", 4, [0, 4, 8, 12, 1, 5, 9, 13, 2, 6, 10, 14, 3, 7, 11, 15]], ["CA", 3, 4, 11], ["CHR", 2, "shared", [3]], ["CA", 3, 4, 14], ["CHR", 1, "shared", [4]], ["CA", 2, 5, 14], ["CI", 1], ["FU", 12, [0, 1, 2, 3]], ["AN", 12, 0, 5], ["FU", 12, [1, 2, 3, 4]], ["AN", 12, 1, 4], ["FU", 12, [2, 3, 4, 5]], ["AN", 12, 2, 6], ["FU", 10, [0, 1, 2, 3]], ["SP", 10, 0, 2, [1], 1], ["AN", 10, 1, 2], ["FFSP", 10, 0, [4, 3, 2, 1], 1, 1], ["AN", 10, 1, 6], ["FU", 8, [0, 1, 2, 3]], ["SP", 8, 0, 1, [1], 1], ["AN", 8, 1, 2], ["FFSP", 8, 0, [4, 3, 2, 1], 1, 1], ["AN", 8, 1, 6], ["FU", 6, [0, 1, 2, 3]], ["AN", 6, 0, 5], ["FU", 6, [1, 2, 3, 4]], ["AN", 6, 1, 4], ["FU", 6, [2, 3, 4, 5]], ["AN", 6, 2, 6], ["FU", 4, [0, 1, 2, 3]], ["SP", 4, 0, 9, [3], 1], ["AN", 4, 1, 2], ["FFSP", 4, 0, [24, 23, 22, 21], 1, 1], ["AN", 4, 1, 6], ["FU", 2, [0, 1, 2, 3]], ["SP", 2, 0, 9, [1], 1], ["AN", 2, 1, 2], ["FFSP", 2, 0, [24, 23, 22, 21], 1, 1], ["AN", 2, 1, 6], ["PR", 5, 0, "auto_unroll_max_step$512"], ["PR", 11, 0, "auto_unroll_max_step$0"]]]], "r": [[4.84821e-06], 0, 1.98931, 1607392420], "v": "v0.3"}
{"i": [["[\"sepconv\", 2, 5, 5, 4, 3, 3, 3, \"float32\"]", "cuda -keys=cuda,gpu -max_num_threads=1024 -thread_warp_size=32", [-1, 16, 64, 49152, 65536, 1024, 8, 32]], [[], [["CHW", 6, "local"], ["SP", 6, 0, 2, [2, 1, 1, 1], 1], ["SP", 6, 5, 4, [1, 2, 1, 2], 1], ["SP", 6, 10, 3, [1, 3, 1, 1], 1], ["SP", 6, 15, 3, [1, 1, 1, 1], 1], ["SP", 6, 20, 3, [1, 1], 1], ["SP", 6, 23, 1, [1, 1], 1], ["SP", 6, 26, 1, [1, 1], 1], ["RE", 6, [0, 5, 10, 15, 1, 6, 11, 16, 2, 7, 12, 17, 20, 23, 26, 21, 24, 27, 3, 8, 13, 18, 22, 25, 28, 4, 9, 14, 19]], ["FSP", 7, 0, 1, 3], ["FSP", 7, 4, 2, 3], ["FSP", 7, 8, 3, 3], ["FSP", 7, 12, 4, 3], ["RE", 7, [0, 4, 8, 12, 1, 5, 9, 13, 2, 6, 10, 14, 3, 7, 11, 15]], ["CA", 6, 7, 11], ["CHR", 5, "shared", [6]], ["CA", 6, 7, 14], ["CHR", 4, "shared", [7]], ["CA", 5, 8, 14], ["CI", 4], ["CHW", 3, "local"], ["SP", 3, 0, 2, [1, 2, 1, 1], 1], ["SP", 3, 5, 3, [3, 1, 1, 1], 1], ["SP", 3, 10, 3, [1, 3, 1, 1], 1], ["SP", 3, 15, 3, [1, 1, 1, 1], 1], ["SP", 3, 20, 1, [1, 1], 1], ["SP", 3, 23, 3, [1, 3], 1], ["SP", 3, 26, 3, [1, 3], 1], ["RE", 3, [0, 5, 10, 15, 1, 6, 11, 16, 2, 7, 12, 17, 20, 23, 26, 21, 24, 27, 3, 8, 13, 18, 22, 25, 28, 4, 9, 14, 19]], ["FSP", 4, 0, 21, 3], ["FSP", 4, 4, 22, 3], ["FSP", 4, 8, 23, 3], ["FSP", 4, 12, 24, 3], ["RE", 4, [0, 4, 8, 12, 1, 5, 9, 13, 2, 6, 10, 14, 3, 7, 11, 15]], ["CA", 3, 4, 11], ["CHR", 2, "shared", [3]], ["CA", 3, 4, 14], ["CHR", 1, "shared", [4]], ["CA", 2, 5, 14], ["CI", 1], ["FU", 12, [0, 1, 2, 3]], ["AN", 12, 0, 5], ["FU", 12, [1, 2, 3, 4]], ["AN", 12, 1, 4], ["FU", 12, [2, 3, 4, 5]], ["AN", 12, 2, 6], ["FU", 10, [0, 1, 2, 3]], ["SP", 10, 0, 2, [2], 1], ["AN", 10, 1, 2], ["FFSP", 10, 0, [4, 3, 2, 1], 1, 1], ["AN", 10, 1, 6], ["FU", 8, [0, 1, 2, 3]], ["SP", 8, 0, 1, [1], 1], ["AN", 8, 1, 2], ["FFSP", 8, 0, [4, 3, 2, 1], 1, 1], ["AN", 8, 1, 6], ["FU", 6, [0, 1, 2, 3]], ["AN", 6, 0, 5], ["FU", 6, [1, 2, 3, 4]], ["AN", 6, 1, 4], ["FU", 6, [2, 3, 4, 5]], ["AN", 6, 2, 6], ["FU", 4, [0, 1, 2, 3]], ["SP", 4, 0, 9, [1], 1], ["AN", 4, 1, 2], ["FFSP", 4, 0, [24, 23, 22, 21], 1, 1], ["AN", 4, 1, 6], ["FU", 2, [0, 1, 2, 3]], ["SP", 2, 0, 9, [1], 1], ["AN", 2, 1, 2], ["FFSP", 2, 0, [24, 23, 22, 21], 1, 1], ["AN", 2, 1, 6], ["PR", 5, 0, "auto_unroll_max_step$512"], ["PR", 11, 0, "auto_unroll_max_step$0"]]]], "r": [[5.21492e-06], 0, 1.64266, 1607392421], "v": "v0.3"}
{"i": [["[\"sepconv\", 2, 5, 5, 4, 3, 3, 3, \"float32\"]", "cuda -keys=cuda,gpu -max_num_threads=1024 -thread_warp_size=32", [-1, 16, 64, 49152, 65536, 1024, 8, 32]], [[], [["CHW", 6, "local"], ["SP", 6, 0, 2, [1, 2, 1, 1], 1], ["SP", 6, 5, 4, [1, 2, 1, 2], 1], ["SP", 6, 10, 3, [1, 3, 1, 1], 1], ["SP", 6, 15, 3, [1, 1, 1, 3], 1], ["SP", 6, 20, 3, [1, 1], 1], ["SP", 6, 23, 1, [1, 1], 1], ["SP", 6, 26, 1, [1, 1], 1], ["RE", 6, [0, 5, 10, 15, 1, 6, 11, 16, 2, 7, 12, 17, 20, 23, 26, 21, 24, 27, 3, 8, 13, 18, 22, 25, 28, 4, 9, 14, 19]], ["FSP", 7, 0, 1, 3], ["FSP", 7, 4, 2, 3], ["FSP", 7, 8, 3, 3], ["FSP", 7, 12, 4, 3], ["RE", 7, [0, 4, 8, 12, 1, 5, 9, 13, 2, 6, 10, 14, 3, 7, 11, 15]], ["CA", 6, 7, 11], ["CHR", 5, "shared", [6]], ["CA", 6, 7, 14], ["CHR", 4, "shared", [7]], ["CA", 5, 8, 14], ["CI", 4], ["CHW", 3, "local"], ["SP", 3, 0, 2, [1, 2, 1, 1], 1], ["SP", 3, 5, 3, [1, 3, 1, 1], 1], ["SP", 3, 10, 3, [1, 3, 1, 1], 1], ["SP", 3, 15, 3, [1, 3, 1, 1], 1], ["SP", 3, 20, 1, [1, 1], 1], ["SP", 3, 23, 3, [1, 3], 1], ["SP", 3, 26, 3, [3, 1], 1], ["RE", 3, [0, 5, 10, 15, 1, 6, 11, 16, 2, 7, 12, 17, 20, 23, 26, 21, 24, 27, 3, 8, 13, 18, 22, 25, 28, 4, 9, 14, 19]], ["FSP", 4, 0, 21, 3], ["FSP", 4, 4, 22, 3], ["FSP", 4, 8, 23, 3], ["FSP", 4, 12, 24, 3], ["RE", 4, [0, 4, 8, 12, 1, 5, 9, 13, 2, 6, 10, 14, 3, 7, 11, 15]], ["CA", 3, 4, 11], ["CHR", 2, "shared", [3]], ["CA", 3, 4, 14], ["CHR", 1, "shared", [4]], ["CA", 2, 5, 14], ["CI", 1], ["FU", 12, [0, 1, 2, 3]], ["AN", 12, 0, 5], ["FU", 12, [1, 2, 3, 4]], ["AN", 12, 1, 4], ["FU", 12, [2, 3, 4, 5]], ["AN", 12, 2, 6], ["FU", 10, [0, 1, 2, 3]], ["SP", 10, 0, 2, [1], 1], ["AN", 10, 1, 2], ["FFSP", 10, 0, [4, 3, 2, 1], 1, 1], ["AN", 10, 1, 6], ["FU", 8, [0, 1, 2, 3]], ["SP", 8, 0, 1, [1], 1], ["AN", 8, 1, 2], ["FFSP", 8, 0, [4, 3, 2, 1], 1, 1], ["AN", 8, 1, 6], ["FU", 6, [0, 1, 2, 3]], ["AN", 6, 0, 5], ["FU", 6, [1, 2, 3, 4]], ["AN", 6, 1, 4], ["FU", 6, [2, 3, 4, 5]], ["AN", 6, 2, 6], ["FU", 4, [0, 1, 2, 3]], ["SP", 4, 0, 9, [1], 1], ["AN", 4, 1, 2], ["FFSP", 4, 0, [24, 23, 22, 21], 1, 1], ["AN", 4, 1, 6], ["FU", 2, [0, 1, 2, 3]], ["SP", 2, 0, 9, [9], 1], ["AN", 2, 1, 2], ["FFSP", 2, 0, [24, 23, 22, 21], 1, 1], ["AN", 2, 1, 6], ["PR", 5, 0, "auto_unroll_max_step$64"], ["PR", 11, 0, "auto_unroll_max_step$0"]]]], "r": [[4.90809e-06], 0, 1.56614, 1607392422], "v": "v0.3"}
{"i": [["[\"sepconv\", 2, 5, 5, 4, 3, 3, 3, \"float32\"]", "cuda -keys=cuda,gpu -max_num_threads=1024 -thread_warp_size=32", [-1, 16, 64, 49152, 65536, 1024, 8, 32]], [[], [["CHW", 6, "local"], ["SP", 6, 0, 2, [1, 1, 2, 1], 1], ["SP", 6, 5, 4, [1, 2, 1, 2], 1], ["SP", 6, 10, 3, [1, 3, 1, 1], 1], ["SP", 6, 15, 3, [1, 3, 1, 1], 1], ["SP", 6, 20, 3, [1, 1], 1], ["SP", 6, 23, 1, [1, 1], 1], ["SP", 6, 26, 1, [1, 1], 1], ["RE", 6, [0, 5, 10, 15, 1, 6, 11, 16, 2, 7, 12, 17, 20, 23, 26, 21, 24, 27, 3, 8, 13, 18, 22, 25, 28, 4, 9, 14, 19]], ["FSP", 7, 0, 1, 3], ["FSP", 7, 4, 2, 3], ["FSP", 7, 8, 3, 3], ["FSP", 7, 12, 4, 3], ["RE", 7, [0, 4, 8, 12, 1, 5, 9, 13, 2, 6, 10, 14, 3, 7, 11, 15]], ["CA", 6, 7, 11], ["CHR", 5, "shared", [6]], ["CA", 6, 7, 14], ["CHR", 4, "shared", [7]], ["CA", 5, 8, 14], ["CI", 4], ["CHW", 3, "local"], ["SP", 3, 0, 2, [1, 2, 1, 1], 1], ["SP", 3, 5, 3, [3, 1, 1, 1], 1], ["SP", 3, 10, 3, [1, 1, 1, 1], 1], ["SP", 3, 15, 3, [1, 3, 1, 1], 1], ["SP", 3, 20, 1, [1, 1], 1], ["SP", 3, 23, 3, [1, 3], 1], ["SP", 3, 26, 3, [1, 3], 1], ["RE", 3, [0, 5, 10, 15, 1, 6, 11, 16, 2, 7, 12, 17, 20, 23, 26, 21, 24, 27, 3, 8, 13, 18, 22, 25, 28, 4, 9, 14, 19]], ["FSP", 4, 0, 21, 3], ["FSP", 4, 4, 22, 3], ["FSP", 4, 8, 23, 3], ["FSP", 4, 12, 24, 3], ["RE", 4, [0, 4, 8, 12, 1, 5, 9, 13, 2, 6, 10, 14, 3, 7, 11, 15]], ["CA", 3, 4, 11], ["CHR", 2, "shared", [3]], ["CA", 3, 4, 14], ["CHR", 1, "shared", [4]], ["CA", 2, 5, 14], ["CI", 1], ["FU", 12, [0, 1, 2, 3]], ["AN", 12, 0, 5], ["FU", 12, [1, 2, 3, 4]], ["AN", 12, 1, 4], ["FU", 12, [2, 3, 4, 5]], ["AN", 12, 2, 6], ["FU", 10, [0, 1, 2, 3]], ["SP", 10, 0, 2, [1], 1], ["AN", 10, 1, 2], ["FFSP", 10, 0, [4, 3, 2, 1], 1, 1], ["AN", 10, 1, 6], ["FU", 8, [0, 1, 2, 3]], ["SP", 8, 0, 1, [1], 1], ["AN", 8, 1, 2], ["FFSP", 8, 0, [4, 3, 2, 1], 1, 1], ["AN", 8, 1, 6], ["FU", 6, [0, 1, 2, 3]], ["AN", 6, 0, 5], ["FU", 6, [1, 2, 3, 4]], ["AN", 6, 1, 4], ["FU", 6, [2, 3, 4, 5]], ["AN", 6, 2, 6], ["FU", 4, [0, 1, 2, 3]], ["SP", 4, 0, 9, [1], 1], ["AN", 4, 1, 2], ["FFSP", 4, 0, [24, 23, 22, 21], 1, 1], ["AN", 4, 1, 6], ["FU", 2, [0, 1, 2, 3]], ["SP", 2, 0, 9, [1], 1], ["AN", 2, 1, 2], ["FFSP", 2, 0, [24, 23, 22, 21], 1, 1], ["AN", 2, 1, 6], ["PR", 5, 0, "auto_unroll_max_step$64"], ["PR", 11, 0, "auto_unroll_max_step$0"]]]], "r": [[4.80199e-06], 0, 2.0704, 1607392423], "v": "v0.3"}
{"i": [["[\"sepconv\", 2, 5, 5, 4, 3, 3, 3, \"float32\"]", "cuda -keys=cuda,gpu -max_num_threads=1024 -thread_warp_size=32", [-1, 16, 64, 49152, 65536, 1024, 8, 32]], [[], [["CHW", 6, "local"], ["SP", 6, 0, 2, [1, 1, 1, 2], 1], ["SP", 6, 5, 4, [1, 2, 1, 2], 1], ["SP", 6, 10, 3, [3, 1, 1, 1], 1], ["SP", 6, 15, 3, [1, 1, 1, 3], 1], ["SP", 6, 20, 3, [1, 1], 1], ["SP", 6, 23, 1, [1, 1], 1], ["SP", 6, 26, 1, [1, 1], 1], ["RE", 6, [0, 5, 10, 15, 1, 6, 11, 16, 2, 7, 12, 17, 20, 23, 26, 21, 24, 27, 3, 8, 13, 18, 22, 25, 28, 4, 9, 14, 19]], ["FSP", 7, 0, 1, 3], ["FSP", 7, 4, 2, 3], ["FSP", 7, 8, 3, 3], ["FSP", 7, 12, 4, 3], ["RE", 7, [0, 4, 8, 12, 1, 5, 9, 13, 2, 6, 10, 14, 3, 7, 11, 15]], ["CA", 6, 7, 11], ["CHR", 5, "shared", [6]], ["CA", 6, 7, 14], ["CHR", 4, "shared", [7]], ["CA", 5, 8, 14], ["CI", 4], ["CHW", 3, "local"], ["SP", 3, 0, 2, [1, 2, 1, 1], 1], ["SP", 3, 5, 3, [3, 1, 1, 1], 1], ["SP", 3, 10, 3, [1, 1, 3, 1], 1], ["SP", 3, 15, 3, [1, 3, 1, 1], 1], ["SP", 3, 20, 1, [1, 1], 1], ["SP", 3, 23, 3, [1, 3], 1], ["SP", 3, 26, 3, [1, 3], 1], ["RE", 3, [0, 5, 10, 15, 1, 6, 11, 16, 2, 7, 12, 17, 20, 23, 26, 21, 24, 27, 3, 8, 13, 18, 22, 25, 28, 4, 9, 14, 19]], ["FSP", 4, 0, 21, 3], ["FSP", 4, 4, 22, 3], ["FSP", 4, 8, 23, 3], ["FSP", 4, 12, 24, 3], ["RE", 4, [0, 4, 8, 12, 1, 5, 9, 13, 2, 6, 10, 14, 3, 7, 11, 15]], ["CA", 3, 4, 11], ["CHR", 2, "shared", [3]], ["CA", 3, 4, 14], ["CHR", 1, "shared", [4]], ["CA", 2, 5, 14], ["CI", 1], ["FU", 12, [0, 1, 2, 3]], ["AN", 12, 0, 5], ["FU", 12, [1, 2, 3, 4]], ["AN", 12, 1, 4], ["FU", 12, [2, 3, 4, 5]], ["AN", 12, 2, 6], ["FU", 10, [0, 1, 2, 3]], ["SP", 10, 0, 2, [1], 1], ["AN", 10, 1, 2], ["FFSP", 10, 0, [4, 3, 2, 1], 1, 1], ["AN", 10, 1, 6], ["FU", 8, [0, 1, 2, 3]], ["SP", 8, 0, 1, [1], 1], ["AN", 8, 1, 2], ["FFSP", 8, 0, [4, 3, 2, 1], 1, 1], ["AN", 8, 1, 6], ["FU", 6, [0, 1, 2, 3]], ["AN", 6, 0, 5], ["FU", 6, [1, 2, 3, 4]], ["AN", 6, 1, 4], ["FU", 6, [2, 3, 4, 5]], ["AN", 6, 2, 6], ["FU", 4, [0, 1, 2, 3]], ["SP", 4, 0, 9, [1], 1], ["AN", 4, 1, 2], ["FFSP", 4, 0, [24, 23, 22, 21], 1, 1], ["AN", 4, 1, 6], ["FU", 2, [0, 1, 2, 3]], ["SP", 2, 0, 9, [1], 1], ["AN", 2, 1, 2], ["FFSP", 2, 0, [24, 23, 22, 21], 1, 1], ["AN", 2, 1, 6], ["PR", 5, 0, "auto_unroll_max_step$64"], ["PR", 11, 0, "auto_unroll_max_step$0"]]]], "r": [[4.75821e-06], 0, 2.12326, 1607392425], "v": "v0.3"}
{"i": [["[\"sepconv\", 2, 5, 5, 4, 3, 3, 3, \"float32\"]", "cuda -keys=cuda,gpu -max_num_threads=1024 -thread_warp_size=32", [-1, 16, 64, 49152, 65536, 1024, 8, 32]], [[], [["CHW", 6, "local"], ["SP", 6, 0, 2, [1, 2, 1, 1], 1], ["SP", 6, 5, 4, [1, 2, 1, 2], 1], ["SP", 6, 10, 3, [1, 3, 1, 1], 1], ["SP", 6, 15, 3, [1, 3, 1, 1], 1], ["SP", 6, 20, 3, [1, 1], 1], ["SP", 6, 23, 1, [1, 1], 1], ["SP", 6, 26, 1, [1, 1], 1], ["RE", 6, [0, 5, 10, 15, 1, 6, 11, 16, 2, 7, 12, 17, 20, 23, 26, 21, 24, 27, 3, 8, 13, 18, 22, 25, 28, 4, 9, 14, 19]], ["FSP", 7, 0, 1, 3], ["FSP", 7, 4, 2, 3], ["FSP", 7, 8, 3, 3], ["FSP", 7, 12, 4, 3], ["RE", 7, [0, 4, 8, 12, 1, 5, 9, 13, 2, 6, 10, 14, 3, 7, 11, 15]], ["CA", 6, 7, 11], ["CHR", 5, "shared", [6]], ["CA", 6, 7, 14], ["CHR", 4, "shared", [7]], ["CA", 5, 8, 14], ["CI", 4], ["CHW", 3, "local"], ["SP", 3, 0, 2, [1, 2, 1, 1], 1], ["SP", 3, 5, 3, [1, 3, 1, 1], 1], ["SP", 3, 10, 3, [1, 3, 1, 1], 1], ["SP", 3, 15, 3, [1, 3, 1, 1], 1], ["SP", 3, 20, 1, [1, 1], 1], ["SP", 3, 23, 3, [1, 1], 1], ["SP", 3, 26, 3, [1, 3], 1], ["RE", 3, [0, 5, 10, 15, 1, 6, 11, 16, 2, 7, 12, 17, 20, 23, 26, 21, 24, 27, 3, 8, 13, 18, 22, 25, 28, 4, 9, 14, 19]], ["FSP", 4, 0, 21, 3], ["FSP", 4, 4, 22, 3], ["FSP", 4, 8, 23, 3], ["FSP", 4, 12, 24, 3], ["RE", 4, [0, 4, 8, 12, 1, 5, 9, 13, 2, 6, 10, 14, 3, 7, 11, 15]], ["CA", 3, 4, 11], ["CHR", 2, "shared", [3]], ["CA", 3, 4, 14], ["CHR", 1, "shared", [4]], ["CA", 2, 5, 14], ["CI", 1], ["FU", 12, [0, 1, 2, 3]], ["AN", 12, 0, 5], ["FU", 12, [1, 2, 3, 4]], ["AN", 12, 1, 4], ["FU", 12, [2, 3, 4, 5]], ["AN", 12, 2, 6], ["FU", 10, [0, 1, 2, 3]], ["SP", 10, 0, 2, [2], 1], ["AN", 10, 1, 2], ["FFSP", 10, 0, [4, 3, 2, 1], 1, 1], ["AN", 10, 1, 6], ["FU", 8, [0, 1, 2, 3]], ["SP", 8, 0, 1, [1], 1], ["AN", 8, 1, 2], ["FFSP", 8, 0, [4, 3, 2, 1], 1, 1], ["AN", 8, 1, 6], ["FU", 6, [0, 1, 2, 3]], ["AN", 6, 0, 5], ["FU", 6, [1, 2, 3, 4]], ["AN", 6, 1, 4], ["FU", 6, [2, 3, 4, 5]], ["AN", 6, 2, 6], ["FU", 4, [0, 1, 2, 3]], ["SP", 4, 0, 9, [9], 1], ["AN", 4, 1, 2], ["FFSP", 4, 0, [24, 23, 22, 21], 1, 1], ["AN", 4, 1, 6], ["FU", 2, [0, 1, 2, 3]], ["SP", 2, 0, 9, [1], 1], ["AN", 2, 1, 2], ["FFSP", 2, 0, [24, 23, 22, 21], 1, 1], ["AN", 2, 1, 6], ["PR", 5, 0, "auto_unroll_max_step$64"], ["PR", 11, 0, "auto_unroll_max_step$0"]]]], "r": [[5.5712e-06], 0, 1.63357, 1607392426], "v": "v0.3"}
{"i": [["[\"sepconv\", 2, 5, 5, 4, 3, 3, 3, \"float32\"]", "cuda -keys=cuda,gpu -max_num_threads=1024 -thread_warp_size=32", [-1, 16, 64, 49152, 65536, 1024, 8, 32]], [[], [["CHW", 6, "local"], ["SP", 6, 0, 2, [1, 2, 1, 1], 1], ["SP", 6, 5, 4, [1, 2, 1, 2], 1], ["SP", 6, 10, 3, [1, 3, 1, 1], 1], ["SP", 6, 15, 3, [1, 3, 1, 1], 1], ["SP", 6, 20, 3, [1, 1], 1], ["SP", 6, 23, 1, [1, 1], 1], ["SP", 6, 26, 1, [1, 1], 1], ["RE", 6, [0, 5, 10, 15, 1, 6, 11, 16, 2, 7, 12, 17, 20, 23, 26, 21, 24, 27, 3, 8, 13, 18, 22, 25, 28, 4, 9, 14, 19]], ["FSP", 7, 0, 1, 3], ["FSP", 7, 4, 2, 3], ["FSP", 7, 8, 3, 3], ["FSP", 7, 12, 4, 3], ["RE", 7, [0, 4, 8, 12, 1, 5, 9, 13, 2, 6, 10, 14, 3, 7, 11, 15]], ["CA", 6, 7, 11], ["CHR", 5, "shared", [6]], ["CA", 6, 7, 14], ["CHR", 4, "shared", [7]], ["CA", 5, 8, 14], ["CI", 4], ["CHW", 3, "local"], ["SP", 3, 0, 2, [1, 2, 1, 1], 1], ["SP", 3, 5, 3, [1, 3, 1, 1], 1], ["SP", 3, 10, 3, [1, 3, 1, 1], 1], ["SP", 3, 15, 3, [1, 3, 1, 1], 1], ["SP", 3, 20, 1, [1, 1], 1], ["SP", 3, 23, 3, [1, 3], 1], ["SP", 3, 26, 3, [1, 3], 1], ["RE", 3, [0, 5, 10, 15, 1, 6, 11, 16, 2, 7, 12, 17, 20, 23, 26, 21, 24, 27, 3, 8, 13, 18, 22, 25, 28, 4, 9, 14, 19]], ["FSP", 4, 0, 21, 3], ["FSP", 4, 4, 22, 3], ["FSP", 4, 8, 23, 3], ["FSP", 4, 12, 24, 3], ["RE", 4, [0, 4, 8, 12, 1, 5, 9, 13, 2, 6, 10, 14, 3, 7, 11, 15]], ["CA", 3, 4, 11], ["CHR", 2, "shared", [3]], ["CA", 3, 4, 14], ["CHR", 1, "shared", [4]], ["CA", 2, 5, 14], ["CI", 1], ["FU", 12, [0, 1, 2, 3]], ["AN", 12, 0, 5], ["FU", 12, [1, 2, 3, 4]], ["AN", 12, 1, 4], ["FU", 12, [2, 3, 4, 5]], ["AN", 12, 2, 6], ["FU", 10, [0, 1, 2, 3]], ["SP", 10, 0, 2, [2], 1], ["AN", 10, 1, 2], ["FFSP", 10, 0, [4, 3, 2, 1], 1, 1], ["AN", 10, 1, 6], ["FU", 8, [0, 1, 2, 3]], ["SP", 8, 0, 1, [1], 1], ["AN", 8, 1, 2], ["FFSP", 8, 0, [4, 3, 2, 1], 1, 1], ["AN", 8, 1, 6], ["FU", 6, [0, 1, 2, 3]], ["AN", 6, 0, 5], ["FU", 6, [1, 2, 3, 4]], ["AN", 6, 1, 4], ["FU", 6, [2, 3, 4, 5]], ["AN", 6, 2, 6], ["FU", 4, [0, 1, 2, 3]], ["SP", 4, 0, 9, [1], 1], ["AN", 4, 1, 2], ["FFSP", 4, 0, [24, 23, 22, 21], 1, 1], ["AN", 4, 1, 6], ["FU", 2, [0, 1, 2, 3]], ["SP", 2, 0, 9, [1], 1], ["AN", 2, 1, 2], ["FFSP", 2, 0, [24, 23, 22, 21], 1, 1], ["AN", 2, 1, 6], ["PR", 5, 0, "auto_unroll_max_step$64"], ["PR", 11, 0, "auto_unroll_max_step$0"]]]], "r": [[5.27465e-06], 0, 1.60699, 1607392427], "v": "v0.3"}
{"i": [["[\"sepconv\", 2, 5, 5, 4, 3, 3, 3, \"float32\"]", "cuda -keys=cuda,gpu -max_num_threads=1024 -thread_warp_size=32", [-1, 16, 64, 49152, 65536, 1024, 8, 32]], [[], [["CHW", 6, "local"], ["SP", 6, 0, 2, [1, 2, 1, 1], 1], ["SP", 6, 5, 4, [1, 2, 1, 2], 1], ["SP", 6, 10, 3, [1, 3, 1, 1], 1], ["SP", 6, 15, 3, [1, 3, 1, 1], 1], ["SP", 6, 20, 3, [1, 1], 1], ["SP", 6, 23, 1, [1, 1], 1], ["SP", 6, 26, 1, [1, 1], 1], ["RE", 6, [0, 5, 10, 15, 1, 6, 11, 16, 2, 7, 12, 17, 20, 23, 26, 21, 24, 27, 3, 8, 13, 18, 22, 25, 28, 4, 9, 14, 19]], ["FSP", 7, 0, 1, 3], ["FSP", 7, 4, 2, 3], ["FSP", 7, 8, 3, 3], ["FSP", 7, 12, 4, 3], ["RE", 7, [0, 4, 8, 12, 1, 5, 9, 13, 2, 6, 10, 14, 3, 7, 11, 15]], ["CA", 6, 7, 11], ["CHR", 5, "shared", [6]], ["CA", 6, 7, 14], ["CHR", 4, "shared", [7]], ["CA", 5, 8, 14], ["CI", 4], ["CHW", 3, "local"], ["SP", 3, 0, 2, [1, 2, 1, 1], 1], ["SP", 3, 5, 3, [1, 3, 1, 1], 1], ["SP", 3, 10, 3, [1, 3, 1, 1], 1], ["SP", 3, 15, 3, [1, 3, 1, 1], 1], ["SP", 3, 20, 1, [1, 1], 1], ["SP", 3, 23, 3, [3, 1], 1], ["SP", 3, 26, 3, [3, 1], 1], ["RE", 3, [0, 5, 10, 15, 1, 6, 11, 16, 2, 7, 12, 17, 20, 23, 26, 21, 24, 27, 3, 8, 13, 18, 22, 25, 28, 4, 9, 14, 19]], ["FSP", 4, 0, 21, 3], ["FSP", 4, 4, 22, 3], ["FSP", 4, 8, 23, 3], ["FSP", 4, 12, 24, 3], ["RE", 4, [0, 4, 8, 12, 1, 5, 9, 13, 2, 6, 10, 14, 3, 7, 11, 15]], ["CA", 3, 4, 11], ["CHR", 2, "shared", [3]], ["CA", 3, 4, 14], ["CHR", 1, "shared", [4]], ["CA", 2, 5, 14], ["CI", 1], ["FU", 12, [0, 1, 2, 3]], ["AN", 12, 0, 5], ["FU", 12, [1, 2, 3, 4]], ["AN", 12, 1, 4], ["FU", 12, [2, 3, 4, 5]], ["AN", 12, 2, 6], ["FU", 10, [0, 1, 2, 3]], ["SP", 10, 0, 2, [2], 1], ["AN", 10, 1, 2], ["FFSP", 10, 0, [4, 3, 2, 1], 1, 1], ["AN", 10, 1, 6], ["FU", 8, [0, 1, 2, 3]], ["SP", 8, 0, 1, [1], 1], ["AN", 8, 1, 2], ["FFSP", 8, 0, [4, 3, 2, 1], 1, 1], ["AN", 8, 1, 6], ["FU", 6, [0, 1, 2, 3]], ["AN", 6, 0, 5], ["FU", 6, [1, 2, 3, 4]], ["AN", 6, 1, 4], ["FU", 6, [2, 3, 4, 5]], ["AN", 6, 2, 6], ["FU", 4, [0, 1, 2, 3]], ["SP", 4, 0, 9, [1], 1], ["AN", 4, 1, 2], ["FFSP", 4, 0, [24, 23, 22, 21], 1, 1], ["AN", 4, 1, 6], ["FU", 2, [0, 1, 2, 3]], ["SP", 2, 0, 9, [1], 1], ["AN", 2, 1, 2], ["FFSP", 2, 0, [24, 23, 22, 21], 1, 1], ["AN", 2, 1, 6], ["PR", 5, 0, "auto_unroll_max_step$64"], ["PR", 11, 0, "auto_unroll_max_step$0"]]]], "r": [[5.25916e-06], 0, 1.97034, 1607392428], "v": "v0.3"}
{"i": [["[\"sepconv\", 2, 5, 5, 4, 3, 3, 3, \"float32\"]", "cuda -keys=cuda,gpu -max_num_threads=1024 -thread_warp_size=32", [-1, 16, 64, 49152, 65536, 1024, 8, 32]], [[], [["CHW", 6, "local"], ["SP", 6, 0, 2, [1, 2, 1, 1], 1], ["SP", 6, 5, 4, [1, 2, 1, 2], 1], ["SP", 6, 10, 3, [1, 3, 1, 1], 1], ["SP", 6, 15, 3, [1, 3, 1, 1], 1], ["SP", 6, 20, 3, [1, 1], 1], ["SP", 6, 23, 1, [1, 1], 1], ["SP", 6, 26, 1, [1, 1], 1], ["RE", 6, [0, 5, 10, 15, 1, 6, 11, 16, 2, 7, 12, 17, 20, 23, 26, 21, 24, 27, 3, 8, 13, 18, 22, 25, 28, 4, 9, 14, 19]], ["FSP", 7, 0, 1, 3], ["FSP", 7, 4, 2, 3], ["FSP", 7, 8, 3, 3], ["FSP", 7, 12, 4, 3], ["RE", 7, [0, 4, 8, 12, 1, 5, 9, 13, 2, 6, 10, 14, 3, 7, 11, 15]], ["CA", 6, 7, 11], ["CHR", 5, "shared", [6]], ["CA", 6, 7, 14], ["CHR", 4, "shared", [7]], ["CA", 5, 8, 14], ["CI", 4], ["CHW", 3, "local"], ["SP", 3, 0, 2, [1, 1, 1, 1], 1], ["SP", 3, 5, 3, [1, 3, 1, 1], 1], ["SP", 3, 10, 3, [1, 3, 1, 1], 1], ["SP", 3, 15, 3, [1, 1, 1, 1], 1], ["SP", 3, 20, 1, [1, 1], 1], ["SP", 3, 23, 3, [1, 3], 1], ["SP", 3, 26, 3, [1, 3], 1], ["RE", 3, [0, 5, 10, 15, 1, 6, 11, 16, 2, 7, 12, 17, 20, 23, 26, 21, 24, 27, 3, 8, 13, 18, 22, 25, 28, 4, 9, 14, 19]], ["FSP", 4, 0, 21, 3], ["FSP", 4, 4, 22, 3], ["FSP", 4, 8, 23, 3], ["FSP", 4, 12, 24, 3], ["RE", 4, [0, 4, 8, 12, 1, 5, 9, 13, 2, 6, 10, 14, 3, 7, 11, 15]], ["CA", 3, 4, 11], ["CHR", 2, "shared", [3]], ["CA", 3, 4, 14], ["CHR", 1, "shared", [4]], ["CA", 2, 5, 14], ["CI", 1], ["FU", 12, [0, 1, 2, 3]], ["AN", 12, 0, 5], ["FU", 12, [1, 2, 3, 4]], ["AN", 12, 1, 4], ["FU", 12, [2, 3, 4, 5]], ["AN", 12, 2, 6], ["FU", 10, [0, 1, 2, 3]], ["SP", 10, 0, 2, [1], 1], ["AN", 10, 1, 2], ["FFSP", 10, 0, [4, 3, 2, 1], 1, 1], ["AN", 10, 1, 6], ["FU", 8, [0, 1, 2, 3]], ["SP", 8, 0, 1, [1], 1], ["AN", 8, 1, 2], ["FFSP", 8, 0, [4, 3, 2, 1], 1, 1], ["AN", 8, 1, 6], ["FU", 6, [0, 1, 2, 3]], ["AN", 6, 0, 5], ["FU", 6, [1, 2, 3, 4]], ["AN", 6, 1, 4], ["FU", 6, [2, 3, 4, 5]], ["AN", 6, 2, 6], ["FU", 4, [0, 1, 2, 3]], ["SP", 4, 0, 9, [1], 1], ["AN", 4, 1, 2], ["FFSP", 4, 0, [24, 23, 22, 21], 1, 1], ["AN", 4, 1, 6], ["FU", 2, [0, 1, 2, 3]], ["SP", 2, 0, 9, [1], 1], ["AN", 2, 1, 2], ["FFSP", 2, 0, [24, 23, 22, 21], 1, 1], ["AN", 2, 1, 6], ["PR", 5, 0, "auto_unroll_max_step$64"], ["PR", 11, 0, "auto_unroll_max_step$0"]]]], "r": [[5.25599e-06], 0, 2.02281, 1607392429], "v": "v0.3"}
{"i": [["[\"sepconv\", 2, 5, 5, 4, 3, 3, 3, \"float32\"]", "cuda -keys=cuda,gpu -max_num_threads=1024 -thread_warp_size=32", [-1, 16, 64, 49152, 65536, 1024, 8, 32]], [[], [["CHW", 6, "local"], ["SP", 6, 0, 2, [1, 2, 1, 1], 1], ["SP", 6, 5, 4, [1, 4, 1, 1], 1], ["SP", 6, 10, 3, [1, 3, 1, 1], 1], ["SP", 6, 15, 3, [1, 1, 1, 1], 1], ["SP", 6, 20, 3, [1, 3], 1], ["SP", 6, 23, 1, [1, 1], 1], ["SP", 6, 26, 1, [1, 1], 1], ["RE", 6, [0, 5, 10, 15, 1, 6, 11, 16, 2, 7, 12, 17, 20, 23, 26, 21, 24, 27, 3, 8, 13, 18, 22, 25, 28, 4, 9, 14, 19]], ["FSP", 7, 0, 1, 3], ["FSP", 7, 4, 2, 3], ["FSP", 7, 8, 3, 3], ["FSP", 7, 12, 4, 3], ["RE", 7, [0, 4, 8, 12, 1, 5, 9, 13, 2, 6, 10, 14, 3, 7, 11, 15]], ["CA", 6, 7, 11], ["CHR", 5, "shared", [6]], ["CA", 6, 7, 14], ["CHR", 4, "shared", [7]], ["CA", 5, 8, 14], ["CI", 4], ["CHW", 3, "local"], ["SP", 3, 0, 2, [1, 2, 1, 1], 1], ["SP", 3, 5, 3, [1, 3, 1, 1], 1], ["SP", 3, 10, 3, [1, 1, 1, 3], 1], ["SP", 3, 15, 3, [1, 3, 1, 1], 1], ["SP", 3, 20, 1, [1, 1], 1], ["SP", 3, 23, 3, [1, 3], 1], ["SP", 3, 26, 3, [1, 3], 1], ["RE", 3, [0, 5, 10, 15, 1, 6, 11, 16, 2, 7, 12, 17, 20, 23, 26, 21, 24, 27, 3, 8, 13, 18, 22, 25, 28, 4, 9, 14, 19]], ["FSP", 4, 0, 21, 3], ["FSP", 4, 4, 22, 3], ["FSP", 4, 8, 23, 3], ["FSP", 4, 12, 24, 3], ["RE", 4, [0, 4, 8, 12, 1, 5, 9, 13, 2, 6, 10, 14, 3, 7, 11, 15]], ["CA", 3, 4, 11], ["CHR", 2, "shared", [3]], ["CA", 3, 4, 14], ["CHR", 1, "shared", [4]], ["CA", 2, 5, 14], ["CI", 1], ["FU", 12, [0, 1, 2, 3]], ["AN", 12, 0, 5], ["FU", 12, [1, 2, 3, 4]], ["AN", 12, 1, 4], ["FU", 12, [2, 3, 4, 5]], ["AN", 12, 2, 6], ["FU", 10, [0, 1, 2, 3]], ["SP", 10, 0, 2, [1], 1], ["AN", 10, 1, 2], ["FFSP", 10, 0, [4, 3, 2, 1], 1, 1], ["AN", 10, 1, 6], ["FU", 8, [0, 1, 2, 3]], ["SP", 8, 0, 1, [1], 1], ["AN", 8, 1, 2], ["FFSP", 8, 0, [4, 3, 2, 1], 1, 1], ["AN", 8, 1, 6], ["FU", 6, [0, 1, 2, 3]], ["AN", 6, 0, 5], ["FU", 6, [1, 2, 3, 4]], ["AN", 6, 1, 4], ["FU", 6, [2, 3, 4, 5]], ["AN", 6, 2, 6], ["FU", 4, [0, 1, 2, 3]], ["SP", 4, 0, 9, [1], 1], ["AN", 4, 1, 2], ["FFSP", 4, 0, [24, 23, 22, 21], 1, 1], ["AN", 4, 1, 6], ["FU", 2, [0, 1, 2, 3]], ["SP", 2, 0, 9, [3], 1], ["AN", 2, 1, 2], ["FFSP", 2, 0, [24, 23, 22, 21], 1, 1], ["AN", 2, 1, 6], ["PR", 5, 0, "auto_unroll_max_step$64"], ["PR", 11, 0, "auto_unroll_max_step$0"]]]], "r": [[5.16246e-06], 0, 2.00938, 1607392431], "v": "v0.3"}
{"i": [["[\"sepconv\", 2, 5, 5, 4, 3, 3, 3, \"float32\"]", "cuda -keys=cuda,gpu -max_num_threads=1024 -thread_warp_size=32", [-1, 16, 64, 49152, 65536, 1024, 8, 32]], [[], [["CHW", 6, "local"], ["SP", 6, 0, 2, [1, 2, 1, 1], 1], ["SP", 6, 5, 4, [1, 4, 1, 1], 1], ["SP", 6, 10, 3, [1, 1, 3, 1], 1], ["SP", 6, 15, 3, [1, 1, 1, 3], 1], ["SP", 6, 20, 3, [1, 1], 1], ["SP", 6, 23, 1, [1, 1], 1], ["SP", 6, 26, 1, [1, 1], 1], ["RE", 6, [0, 5, 10, 15, 1, 6, 11, 16, 2, 7, 12, 17, 20, 23, 26, 21, 24, 27, 3, 8, 13, 18, 22, 25, 28, 4, 9, 14, 19]], ["FSP", 7, 0, 1, 3], ["FSP", 7, 4, 2, 3], ["FSP", 7, 8, 3, 3], ["FSP", 7, 12, 4, 3], ["RE", 7, [0, 4, 8, 12, 1, 5, 9, 13, 2, 6, 10, 14, 3, 7, 11, 15]], ["CA", 6, 7, 11], ["CHR", 5, "shared", [6]], ["CA", 6, 7, 14], ["CHR", 4, "shared", [7]], ["CA", 5, 8, 14], ["CI", 4], ["CHW", 3, "local"], ["SP", 3, 0, 2, [1, 2, 1, 1], 1], ["SP", 3, 5, 3, [1, 3, 1, 1], 1], ["SP", 3, 10, 3, [1, 3, 1, 1], 1], ["SP", 3, 15, 3, [1, 3, 1, 1], 1], ["SP", 3, 20, 1, [1, 1], 1], ["SP", 3, 23, 3, [1, 3], 1], ["SP", 3, 26, 3, [1, 3], 1], ["RE", 3, [0, 5, 10, 15, 1, 6, 11, 16, 2, 7, 12, 17, 20, 23, 26, 21, 24, 27, 3, 8, 13, 18, 22, 25, 28, 4, 9, 14, 19]], ["FSP", 4, 0, 21, 3], ["FSP", 4, 4, 22, 3], ["FSP", 4, 8, 23, 3], ["FSP", 4, 12, 24, 3], ["RE", 4, [0, 4, 8, 12, 1, 5, 9, 13, 2, 6, 10, 14, 3, 7, 11, 15]], ["CA", 3, 4, 11], ["CHR", 2, "shared", [3]], ["CA", 3, 4, 14], ["CHR", 1, "shared", [4]], ["CA", 2, 5, 14], ["CI", 1], ["FU", 12, [0, 1, 2, 3]], ["AN", 12, 0, 5], ["FU", 12, [1, 2, 3, 4]], ["AN", 12, 1, 4], ["FU", 12, [2, 3, 4, 5]], ["AN", 12, 2, 6], ["FU", 10, [0, 1, 2, 3]], ["SP", 10, 0, 2, [1], 1], ["AN", 10, 1, 2], ["FFSP", 10, 0, [4, 3, 2, 1], 1, 1], ["AN", 10, 1, 6], ["FU", 8, [0, 1, 2, 3]], ["SP", 8, 0, 1, [1], 1], ["AN", 8, 1, 2], ["FFSP", 8, 0, [4, 3, 2, 1], 1, 1], ["AN", 8, 1, 6], ["FU", 6, [0, 1, 2, 3]], ["AN", 6, 0, 5], ["FU", 6, [1, 2, 3, 4]], ["AN", 6, 1, 4], ["FU", 6, [2, 3, 4, 5]], ["AN", 6, 2, 6], ["FU", 4, [0, 1, 2, 3]], ["SP", 4, 0, 9, [1], 1], ["AN", 4, 1, 2], ["FFSP", 4, 0, [24, 23, 22, 21], 1, 1], ["AN", 4, 1, 6], ["FU", 2, [0, 1, 2, 3]], ["SP", 2, 0, 9, [1], 1], ["AN", 2, 1, 2], ["FFSP", 2, 0, [24, 23, 22, 21], 1, 1], ["AN", 2, 1, 6], ["PR", 5, 0, "auto_unroll_max_step$64"], ["PR", 11, 0, "auto_unroll_max_step$64"]]]], "r": [[4.85715e-06], 0, 2.02031, 1607392432], "v": "v0.3"}
{"i": [["[\"sepconv\", 2, 5, 5, 4, 3, 3, 3, \"float32\"]", "cuda -keys=cuda,gpu -max_num_threads=1024 -thread_warp_size=32", [-1, 16, 64, 49152, 65536, 1024, 8, 32]], [[], [["CHW", 6, "local"], ["SP", 6, 0, 2, [1, 2, 1, 1], 1], ["SP", 6, 5, 4, [2, 1, 1, 1], 1], ["SP", 6, 10, 3, [1, 3, 1, 1], 1], ["SP", 6, 15, 3, [1, 3, 1, 1], 1], ["SP", 6, 20, 3, [1, 3], 1], ["SP", 6, 23, 1, [1, 1], 1], ["SP", 6, 26, 1, [1, 1], 1], ["RE", 6, [0, 5, 10, 15, 1, 6, 11, 16, 2, 7, 12, 17, 20, 23, 26, 21, 24, 27, 3, 8, 13, 18, 22, 25, 28, 4, 9, 14, 19]], ["FSP", 7, 0, 1, 3], ["FSP", 7, 4, 2, 3], ["FSP", 7, 8, 3, 3], ["FSP", 7, 12, 4, 3], ["RE", 7, [0, 4, 8, 12, 1, 5, 9, 13, 2, 6, 10, 14, 3, 7, 11, 15]], ["CA", 6, 7, 11], ["CHR", 5, "shared", [6]], ["CA", 6, 7, 14], ["CHR", 4, "shared", [7]], ["CA", 5, 8, 14], ["CI", 4], ["CHW", 3, "local"], ["SP", 3, 0, 2, [1, 2, 1, 1], 1], ["SP", 3, 5, 3, [1, 1, 1, 3], 1], ["SP", 3, 10, 3, [1, 3, 1, 1], 1], ["SP", 3, 15, 3, [1, 3, 1, 1], 1], ["SP", 3, 20, 1, [1, 1], 1], ["SP", 3, 23, 3, [1, 3], 1], ["SP", 3, 26, 3, [1, 3], 1], ["RE", 3, [0, 5, 10, 15, 1, 6, 11, 16, 2, 7, 12, 17, 20, 23, 26, 21, 24, 27, 3, 8, 13, 18, 22, 25, 28, 4, 9, 14, 19]], ["FSP", 4, 0, 21, 3], ["FSP", 4, 4, 22, 3], ["FSP", 4, 8, 23, 3], ["FSP", 4, 12, 24, 3], ["RE", 4, [0, 4, 8, 12, 1, 5, 9, 13, 2, 6, 10, 14, 3, 7, 11, 15]], ["CA", 3, 4, 11], ["CHR", 2, "shared", [3]], ["CA", 3, 4, 14], ["CHR", 1, "shared", [4]], ["CA", 2, 5, 14], ["CI", 1], ["FU", 12, [0, 1, 2, 3]], ["AN", 12, 0, 5], ["FU", 12, [1, 2, 3, 4]], ["AN", 12, 1, 4], ["FU", 12, [2, 3, 4, 5]], ["AN", 12, 2, 6], ["FU", 10, [0, 1, 2, 3]], ["SP", 10, 0, 2, [2], 1], ["AN", 10, 1, 2], ["FFSP", 10, 0, [4, 3, 2, 1], 1, 1], ["AN", 10, 1, 6], ["FU", 8, [0, 1, 2, 3]], ["SP", 8, 0, 1, [1], 1], ["AN", 8, 1, 2], ["FFSP", 8, 0, [4, 3, 2, 1], 1, 1], ["AN", 8, 1, 6], ["FU", 6, [0, 1, 2, 3]], ["AN", 6, 0, 5], ["FU", 6, [1, 2, 3, 4]], ["AN", 6, 1, 4], ["FU", 6, [2, 3, 4, 5]], ["AN", 6, 2, 6], ["FU", 4, [0, 1, 2, 3]], ["SP", 4, 0, 9, [1], 1], ["AN", 4, 1, 2], ["FFSP", 4, 0, [24, 23, 22, 21], 1, 1], ["AN", 4, 1, 6], ["FU", 2, [0, 1, 2, 3]], ["SP", 2, 0, 9, [1], 1], ["AN", 2, 1, 2], ["FFSP", 2, 0, [24, 23, 22, 21], 1, 1], ["AN", 2, 1, 6], ["PR", 5, 0, "auto_unroll_max_step$0"], ["PR", 11, 0, "auto_unroll_max_step$512"]]]], "r": [[5.18269e-06], 0, 2.0663, 1607392433], "v": "v0.3"}
{"i": [["[\"sepconv\", 2, 5, 5, 4, 3, 3, 3, \"float32\"]", "cuda -keys=cuda,gpu -max_num_threads=1024 -thread_warp_size=32", [-1, 16, 64, 49152, 65536, 1024, 8, 32]], [[], [["CHW", 6, "local"], ["SP", 6, 0, 2, [1, 2, 1, 1], 1], ["SP", 6, 5, 4, [1, 2, 1, 2], 1], ["SP", 6, 10, 3, [1, 3, 1, 1], 1], ["SP", 6, 15, 3, [1, 3, 1, 1], 1], ["SP", 6, 20, 3, [3, 1], 1], ["SP", 6, 23, 1, [1, 1], 1], ["SP", 6, 26, 1, [1, 1], 1], ["RE", 6, [0, 5, 10, 15, 1, 6, 11, 16, 2, 7, 12, 17, 20, 23, 26, 21, 24, 27, 3, 8, 13, 18, 22, 25, 28, 4, 9, 14, 19]], ["FSP", 7, 0, 1, 3], ["FSP", 7, 4, 2, 3], ["FSP", 7, 8, 3, 3], ["FSP", 7, 12, 4, 3], ["RE", 7, [0, 4, 8, 12, 1, 5, 9, 13, 2, 6, 10, 14, 3, 7, 11, 15]], ["CA", 6, 7, 11], ["CHR", 5, "shared", [6]], ["CA", 6, 7, 14], ["CHR", 4, "shared", [7]], ["CA", 5, 8, 14], ["CI", 4], ["CHW", 3, "local"], ["SP", 3, 0, 2, [1, 2, 1, 1], 1], ["SP", 3, 5, 3, [1, 1, 3, 1], 1], ["SP", 3, 10, 3, [1, 3, 1, 1], 1], ["SP", 3, 15, 3, [1, 3, 1, 1], 1], ["SP", 3, 20, 1, [1, 1], 1], ["SP", 3, 23, 3, [1, 3], 1], ["SP", 3, 26, 3, [1, 1], 1], ["RE", 3, [0, 5, 10, 15, 1, 6, 11, 16, 2, 7, 12, 17, 20, 23, 26, 21, 24, 27, 3, 8, 13, 18, 22, 25, 28, 4, 9, 14, 19]], ["FSP", 4, 0, 21, 3], ["FSP", 4, 4, 22, 3], ["FSP", 4, 8, 23, 3], ["FSP", 4, 12, 24, 3], ["RE", 4, [0, 4, 8, 12, 1, 5, 9, 13, 2, 6, 10, 14, 3, 7, 11, 15]], ["CA", 3, 4, 11], ["CHR", 2, "shared", [3]], ["CA", 3, 4, 14], ["CHR", 1, "shared", [4]], ["CA", 2, 5, 14], ["CI", 1], ["FU", 12, [0, 1, 2, 3]], ["AN", 12, 0, 5], ["FU", 12, [1, 2, 3, 4]], ["AN", 12, 1, 4], ["FU", 12, [2, 3, 4, 5]], ["AN", 12, 2, 6], ["FU", 10, [0, 1, 2, 3]], ["SP", 10, 0, 2, [1], 1], ["AN", 10, 1, 2], ["FFSP", 10, 0, [4, 3, 2, 1], 1, 1], ["AN", 10, 1, 6], ["FU", 8, [0, 1, 2, 3]], ["SP", 8, 0, 1, [1], 1], ["AN", 8, 1, 2], ["FFSP", 8, 0, [4, 3, 2, 1], 1, 1], ["AN", 8, 1, 6], ["FU", 6, [0, 1, 2, 3]], ["AN", 6, 0, 5], ["FU", 6, [1, 2, 3, 4]], ["AN", 6, 1, 4], ["FU", 6, [2, 3, 4, 5]], ["AN", 6, 2, 6], ["FU", 4, [0, 1, 2, 3]], ["SP", 4, 0, 9, [1], 1], ["AN", 4, 1, 2], ["FFSP", 4, 0, [24, 23, 22, 21], 1, 1], ["AN", 4, 1, 6], ["FU", 2, [0, 1, 2, 3]], ["SP", 2, 0, 9, [1], 1], ["AN", 2, 1, 2], ["FFSP", 2, 0, [24, 23, 22, 21], 1, 1], ["AN", 2, 1, 6], ["PR", 5, 0, "auto_unroll_max_step$64"], ["PR", 11, 0, "auto_unroll_max_step$0"]]]], "r": [[4.8842e-06], 0, 2.05173, 1607392435], "v": "v0.3"}
{"i": [["[\"sepconv\", 2, 5, 5, 4, 3, 3, 3, \"float32\"]", "cuda -keys=cuda,gpu -max_num_threads=1024 -thread_warp_size=32", [-1, 16, 64, 49152, 65536, 1024, 8, 32]], [[], [["CHW", 6, "local"], ["SP", 6, 0, 2, [1, 2, 1, 1], 1], ["SP", 6, 5, 4, [1, 4, 1, 1], 1], ["SP", 6, 10, 3, [1, 1, 1, 1], 1], ["SP", 6, 15, 3, [3, 1, 1, 1], 1], ["SP", 6, 20, 3, [1, 1], 1], ["SP", 6, 23, 1, [1, 1], 1], ["SP", 6, 26, 1, [1, 1], 1], ["RE", 6, [0, 5, 10, 15, 1, 6, 11, 16, 2, 7, 12, 17, 20, 23, 26, 21, 24, 27, 3, 8, 13, 18, 22, 25, 28, 4, 9, 14, 19]], ["FSP", 7, 0, 1, 3], ["FSP", 7, 4, 2, 3], ["FSP", 7, 8, 3, 3], ["FSP", 7, 12, 4, 3], ["RE", 7, [0, 4, 8, 12, 1, 5, 9, 13, 2, 6, 10, 14, 3, 7, 11, 15]], ["CA", 6, 7, 11], ["CHR", 5, "shared", [6]], ["CA", 6, 7, 14], ["CHR", 4, "shared", [7]], ["CA", 5, 8, 14], ["CI", 4], ["CHW", 3, "local"], ["SP", 3, 0, 2, [1, 1, 1, 2], 1], ["SP", 3, 5, 3, [1, 3, 1, 1], 1], ["SP", 3, 10, 3, [1, 1, 1, 3], 1], ["SP", 3, 15, 3, [1, 1, 1, 3], 1], ["SP", 3, 20, 1, [1, 1], 1], ["SP", 3, 23, 3, [1, 3], 1], ["SP", 3, 26, 3, [1, 3], 1], ["RE", 3, [0, 5, 10, 15, 1, 6, 11, 16, 2, 7, 12, 17, 20, 23, 26, 21, 24, 27, 3, 8, 13, 18, 22, 25, 28, 4, 9, 14, 19]], ["FSP", 4, 0, 21, 3], ["FSP", 4, 4, 22, 3], ["FSP", 4, 8, 23, 3], ["FSP", 4, 12, 24, 3], ["RE", 4, [0, 4, 8, 12, 1, 5, 9, 13, 2, 6, 10, 14, 3, 7, 11, 15]], ["CA", 3, 4, 11], ["CHR", 2, "shared", [3]], ["CA", 3, 4, 14], ["CHR", 1, "shared", [4]], ["CA", 2, 5, 14], ["CI", 1], ["FU", 12, [0, 1, 2, 3]], ["AN", 12, 0, 5], ["FU", 12, [1, 2, 3, 4]], ["AN", 12, 1, 4], ["FU", 12, [2, 3, 4, 5]], ["AN", 12, 2, 6], ["FU", 10, [0, 1, 2, 3]], ["SP", 10, 0, 2, [1], 1], ["AN", 10, 1, 2], ["FFSP", 10, 0, [4, 3, 2, 1], 1, 1], ["AN", 10, 1, 6], ["FU", 8, [0, 1, 2, 3]], ["SP", 8, 0, 1, [1], 1], ["AN", 8, 1, 2], ["FFSP", 8, 0, [4, 3, 2, 1], 1, 1], ["AN", 8, 1, 6], ["FU", 6, [0, 1, 2, 3]], ["AN", 6, 0, 5], ["FU", 6, [1, 2, 3, 4]], ["AN", 6, 1, 4], ["FU", 6, [2, 3, 4, 5]], ["AN", 6, 2, 6], ["FU", 4, [0, 1, 2, 3]], ["SP", 4, 0, 9, [3], 1], ["AN", 4, 1, 2], ["FFSP", 4, 0, [24, 23, 22, 21], 1, 1], ["AN", 4, 1, 6], ["FU", 2, [0, 1, 2, 3]], ["SP", 2, 0, 9, [1], 1], ["AN", 2, 1, 2], ["FFSP", 2, 0, [24, 23, 22, 21], 1, 1], ["AN", 2, 1, 6], ["PR", 5, 0, "auto_unroll_max_step$512"], ["PR", 11, 0, "auto_unroll_max_step$0"]]]], "r": [[5.03371e-06], 0, 2.20792, 1607392436], "v": "v0.3"}
{"i": [["[\"sepconv\", 2, 5, 5, 4, 3, 3, 3, \"float32\"]", "cuda -keys=cuda,gpu -max_num_threads=1024 -thread_warp_size=32", [-1, 16, 64, 49152, 65536, 1024, 8, 32]], [[], [["CHW", 6, "local"], ["SP", 6, 0, 2, [1, 2, 1, 1], 1], ["SP", 6, 5, 4, [1, 1, 1, 2], 1], ["SP", 6, 10, 3, [1, 3, 1, 1], 1], ["SP", 6, 15, 3, [1, 1, 1, 1], 1], ["SP", 6, 20, 3, [1, 1], 1], ["SP", 6, 23, 1, [1, 1], 1], ["SP", 6, 26, 1, [1, 1], 1], ["RE", 6, [0, 5, 10, 15, 1, 6, 11, 16, 2, 7, 12, 17, 20, 23, 26, 21, 24, 27, 3, 8, 13, 18, 22, 25, 28, 4, 9, 14, 19]], ["FSP", 7, 0, 1, 3], ["FSP", 7, 4, 2, 3], ["FSP", 7, 8, 3, 3], ["FSP", 7, 12, 4, 3], ["RE", 7, [0, 4, 8, 12, 1, 5, 9, 13, 2, 6, 10, 14, 3, 7, 11, 15]], ["CA", 6, 7, 11], ["CHR", 5, "shared", [6]], ["CA", 6, 7, 14], ["CHR", 4, "shared", [7]], ["CA", 5, 8, 14], ["CI", 4], ["CHW", 3, "local"], ["SP", 3, 0, 2, [1, 2, 1, 1], 1], ["SP", 3, 5, 3, [1, 1, 1, 1], 1], ["SP", 3, 10, 3, [1, 3, 1, 1], 1], ["SP", 3, 15, 3, [3, 1, 1, 1], 1], ["SP", 3, 20, 1, [1, 1], 1], ["SP", 3, 23, 3, [1, 3], 1], ["SP", 3, 26, 3, [1, 3], 1], ["RE", 3, [0, 5, 10, 15, 1, 6, 11, 16, 2, 7, 12, 17, 20, 23, 26, 21, 24, 27, 3, 8, 13, 18, 22, 25, 28, 4, 9, 14, 19]], ["FSP", 4, 0, 21, 3], ["FSP", 4, 4, 22, 3], ["FSP", 4, 8, 23, 3], ["FSP", 4, 12, 24, 3], ["RE", 4, [0, 4, 8, 12, 1, 5, 9, 13, 2, 6, 10, 14, 3, 7, 11, 15]], ["CA", 3, 4, 11], ["CHR", 2, "shared", [3]], ["CA", 3, 4, 14], ["CHR", 1, "shared", [4]], ["CA", 2, 5, 14], ["CI", 1], ["FU", 12, [0, 1, 2, 3]], ["AN", 12, 0, 5], ["FU", 12, [1, 2, 3, 4]], ["AN", 12, 1, 4], ["FU", 12, [2, 3, 4, 5]], ["AN", 12, 2, 6], ["FU", 10, [0, 1, 2, 3]], ["SP", 10, 0, 2, [1], 1], ["AN", 10, 1, 2], ["FFSP", 10, 0, [4, 3, 2, 1], 1, 1], ["AN", 10, 1, 6], ["FU", 8, [0, 1, 2, 3]], ["SP", 8, 0, 1, [1], 1], ["AN", 8, 1, 2], ["FFSP", 8, 0, [4, 3, 2, 1], 1, 1], ["AN", 8, 1, 6], ["FU", 6, [0, 1, 2, 3]], ["AN", 6, 0, 5], ["FU", 6, [1, 2, 3, 4]], ["AN", 6, 1, 4], ["FU", 6, [2, 3, 4, 5]], ["AN", 6, 2, 6], ["FU", 4, [0, 1, 2, 3]], ["SP", 4, 0, 9, [1], 1], ["AN", 4, 1, 2], ["FFSP", 4, 0, [24, 23, 22, 21], 1, 1], ["AN", 4, 1, 6], ["FU", 2, [0, 1, 2, 3]], ["SP", 2, 0, 9, [1], 1], ["AN", 2, 1, 2], ["FFSP", 2, 0, [24, 23, 22, 21], 1, 1], ["AN", 2, 1, 6], ["PR", 5, 0, "auto_unroll_max_step$16"], ["PR", 11, 0, "auto_unroll_max_step$0"]]]], "r": [[5.04575e-06], 0, 2.03996, 1607392438], "v": "v0.3"}
{"i": [["[\"sepconv\", 2, 5, 5, 4, 3, 3, 3, \"float32\"]", "cuda -keys=cuda,gpu -max_num_threads=1024 -thread_warp_size=32", [-1, 16, 64, 49152, 65536, 1024, 8, 32]], [[], [["CHW", 6, "local"], ["SP", 6, 0, 2, [1, 2, 1, 1], 1], ["SP", 6, 5, 4, [1, 1, 1, 4], 1], ["SP", 6, 10, 3, [3, 1, 1, 1], 1], ["SP", 6, 15, 3, [1, 3, 1, 1], 1], ["SP", 6, 20, 3, [1, 1], 1], ["SP", 6, 23, 1, [1, 1], 1], ["SP", 6, 26, 1, [1, 1], 1], ["RE", 6, [0, 5, 10, 15, 1, 6, 11, 16, 2, 7, 12, 17, 20, 23, 26, 21, 24, 27, 3, 8, 13, 18, 22, 25, 28, 4, 9, 14, 19]], ["FSP", 7, 0, 1, 3], ["FSP", 7, 4, 2, 3], ["FSP", 7, 8, 3, 3], ["FSP", 7, 12, 4, 3], ["RE", 7, [0, 4, 8, 12, 1, 5, 9, 13, 2, 6, 10, 14, 3, 7, 11, 15]], ["CA", 6, 7, 11], ["CHR", 5, "shared", [6]], ["CA", 6, 7, 14], ["CHR", 4, "shared", [7]], ["CA", 5, 8, 14], ["CI", 4], ["CHW", 3, "local"], ["SP", 3, 0, 2, [1, 2, 1, 1], 1], ["SP", 3, 5, 3, [1, 1, 1, 1], 1], ["SP", 3, 10, 3, [1, 3, 1, 1], 1], ["SP", 3, 15, 3, [3, 1, 1, 1], 1], ["SP", 3, 20, 1, [1, 1], 1], ["SP", 3, 23, 3, [1, 3], 1], ["SP", 3, 26, 3, [1, 3], 1], ["RE", 3, [0, 5, 10, 15, 1, 6, 11, 16, 2, 7, 12, 17, 20, 23, 26, 21, 24, 27, 3, 8, 13, 18, 22, 25, 28, 4, 9, 14, 19]], ["FSP", 4, 0, 21, 3], ["FSP", 4, 4, 22, 3], ["FSP", 4, 8, 23, 3], ["FSP", 4, 12, 24, 3], ["RE", 4, [0, 4, 8, 12, 1, 5, 9, 13, 2, 6, 10, 14, 3, 7, 11, 15]], ["CA", 3, 4, 11], ["CHR", 2, "shared", [3]], ["CA", 3, 4, 14], ["CHR", 1, "shared", [4]], ["CA", 2, 5, 14], ["CI", 1], ["FU", 12, [0, 1, 2, 3]], ["AN", 12, 0, 5], ["FU", 12, [1, 2, 3, 4]], ["AN", 12, 1, 4], ["FU", 12, [2, 3, 4, 5]], ["AN", 12, 2, 6], ["FU", 10, [0, 1, 2, 3]], ["SP", 10, 0, 2, [1], 1], ["AN", 10, 1, 2], ["FFSP", 10, 0, [4, 3, 2, 1], 1, 1], ["AN", 10, 1, 6], ["FU", 8, [0, 1, 2, 3]], ["SP", 8, 0, 1, [1], 1], ["AN", 8, 1, 2], ["FFSP", 8, 0, [4, 3, 2, 1], 1, 1], ["AN", 8, 1, 6], ["FU", 6, [0, 1, 2, 3]], ["AN", 6, 0, 5], ["FU", 6, [1, 2, 3, 4]], ["AN", 6, 1, 4], ["FU", 6, [2, 3, 4, 5]], ["AN", 6, 2, 6], ["FU", 4, [0, 1, 2, 3]], ["SP", 4, 0, 9, [1], 1], ["AN", 4, 1, 2], ["FFSP", 4, 0, [24, 23, 22, 21], 1, 1], ["AN", 4, 1, 6], ["FU", 2, [0, 1, 2, 3]], ["SP", 2, 0, 9, [3], 1], ["AN", 2, 1, 2], ["FFSP", 2, 0, [24, 23, 22, 21], 1, 1], ["AN", 2, 1, 6], ["PR", 5, 0, "auto_unroll_max_step$64"], ["PR", 11, 0, "auto_unroll_max_step$0"]]]], "r": [[5.12827e-06], 0, 2.07725, 1607392439], "v": "v0.3"}
{"i": [["[\"sepconv\", 2, 5, 5, 4, 3, 3, 3, \"float32\"]", "cuda -keys=cuda,gpu -max_num_threads=1024 -thread_warp_size=32", [-1, 16, 64, 49152, 65536, 1024, 8, 32]], [[], [["CHW", 6, "local"], ["SP", 6, 0, 2, [1, 1, 2, 1], 1], ["SP", 6, 5, 4, [1, 2, 1, 2], 1], ["SP", 6, 10, 3, [1, 3, 1, 1], 1], ["SP", 6, 15, 3, [1, 1, 3, 1], 1], ["SP", 6, 20, 3, [1, 3], 1], ["SP", 6, 23, 1, [1, 1], 1], ["SP", 6, 26, 1, [1, 1], 1], ["RE", 6, [0, 5, 10, 15, 1, 6, 11, 16, 2, 7, 12, 17, 20, 23, 26, 21, 24, 27, 3, 8, 13, 18, 22, 25, 28, 4, 9, 14, 19]], ["FSP", 7, 0, 1, 3], ["FSP", 7, 4, 2, 3], ["FSP", 7, 8, 3, 3], ["FSP", 7, 12, 4, 3], ["RE", 7, [0, 4, 8, 12, 1, 5, 9, 13, 2, 6, 10, 14, 3, 7, 11, 15]], ["CA", 6, 7, 11], ["CHR", 5, "shared", [6]], ["CA", 6, 7, 14], ["CHR", 4, "shared", [7]], ["CA", 5, 8, 14], ["CI", 4], ["CHW", 3, "local"], ["SP", 3, 0, 2, [1, 2, 1, 1], 1], ["SP", 3, 5, 3, [1, 1, 3, 1], 1], ["SP", 3, 10, 3, [1, 3, 1, 1], 1], ["SP", 3, 15, 3, [3, 1, 1, 1], 1], ["SP", 3, 20, 1, [1, 1], 1], ["SP", 3, 23, 3, [1, 3], 1], ["SP", 3, 26, 3, [1, 3], 1], ["RE", 3, [0, 5, 10, 15, 1, 6, 11, 16, 2, 7, 12, 17, 20, 23, 26, 21, 24, 27, 3, 8, 13, 18, 22, 25, 28, 4, 9, 14, 19]], ["FSP", 4, 0, 21, 3], ["FSP", 4, 4, 22, 3], ["FSP", 4, 8, 23, 3], ["FSP", 4, 12, 24, 3], ["RE", 4, [0, 4, 8, 12, 1, 5, 9, 13, 2, 6, 10, 14, 3, 7, 11, 15]], ["CA", 3, 4, 11], ["CHR", 2, "shared", [3]], ["CA", 3, 4, 14], ["CHR", 1, "shared", [4]], ["CA", 2, 5, 14], ["CI", 1], ["FU", 12, [0, 1, 2, 3]], ["AN", 12, 0, 5], ["FU", 12, [1, 2, 3, 4]], ["AN", 12, 1, 4], ["FU", 12, [2, 3, 4, 5]], ["AN", 12, 2, 6], ["FU", 10, [0, 1, 2, 3]], ["SP", 10, 0, 2, [1], 1], ["AN", 10, 1, 2], ["FFSP", 10, 0, [4, 3, 2, 1], 1, 1], ["AN", 10, 1, 6], ["FU", 8, [0, 1, 2, 3]], ["SP", 8, 0, 1, [1], 1], ["AN", 8, 1, 2], ["FFSP", 8, 0, [4, 3, 2, 1], 1, 1], ["AN", 8, 1, 6], ["FU", 6, [0, 1, 2, 3]], ["AN", 6, 0, 5], ["FU", 6, [1, 2, 3, 4]], ["AN", 6, 1, 4], ["FU", 6, [2, 3, 4, 5]], ["AN", 6, 2, 6], ["FU", 4, [0, 1, 2, 3]], ["SP", 4, 0, 9, [1], 1], ["AN", 4, 1, 2], ["FFSP", 4, 0, [24, 23, 22, 21], 1, 1], ["AN", 4, 1, 6], ["FU", 2, [0, 1, 2, 3]], ["SP", 2, 0, 9, [1], 1], ["AN", 2, 1, 2], ["FFSP", 2, 0, [24, 23, 22, 21], 1, 1], ["AN", 2, 1, 6], ["PR", 5, 0, "auto_unroll_max_step$64"], ["PR", 11, 0, "auto_unroll_max_step$64"]]]], "r": [[4.84066e-06], 0, 2.12706, 1607392441], "v": "v0.3"}
{"i": [["[\"sepconv\", 2, 5, 5, 4, 3, 3, 3, \"float32\"]", "cuda -keys=cuda,gpu -max_num_threads=1024 -thread_warp_size=32", [-1, 16, 64, 49152, 65536, 1024, 8, 32]], [[], [["CHW", 6, "local"], ["SP", 6, 0, 2, [1, 2, 1, 1], 1], ["SP", 6, 5, 4, [1, 2, 1, 2], 1], ["SP", 6, 10, 3, [1, 3, 1, 1], 1], ["SP", 6, 15, 3, [1, 3, 1, 1], 1], ["SP", 6, 20, 3, [1, 1], 1], ["SP", 6, 23, 1, [1, 1], 1], ["SP", 6, 26, 1, [1, 1], 1], ["RE", 6, [0, 5, 10, 15, 1, 6, 11, 16, 2, 7, 12, 17, 20, 23, 26, 21, 24, 27, 3, 8, 13, 18, 22, 25, 28, 4, 9, 14, 19]], ["FSP", 7, 0, 1, 3], ["FSP", 7, 4, 2, 3], ["FSP", 7, 8, 3, 3], ["FSP", 7, 12, 4, 3], ["RE", 7, [0, 4, 8, 12, 1, 5, 9, 13, 2, 6, 10, 14, 3, 7, 11, 15]], ["CA", 6, 7, 11], ["CHR", 5, "shared", [6]], ["CA", 6, 7, 14], ["CHR", 4, "shared", [7]], ["CA", 5, 8, 14], ["CI", 4], ["CHW", 3, "local"], ["SP", 3, 0, 2, [1, 2, 1, 1], 1], ["SP", 3, 5, 3, [1, 1, 3, 1], 1], ["SP", 3, 10, 3, [1, 3, 1, 1], 1], ["SP", 3, 15, 3, [1, 1, 1, 3], 1], ["SP", 3, 20, 1, [1, 1], 1], ["SP", 3, 23, 3, [1, 3], 1], ["SP", 3, 26, 3, [1, 3], 1], ["RE", 3, [0, 5, 10, 15, 1, 6, 11, 16, 2, 7, 12, 17, 20, 23, 26, 21, 24, 27, 3, 8, 13, 18, 22, 25, 28, 4, 9, 14, 19]], ["FSP", 4, 0, 21, 3], ["FSP", 4, 4, 22, 3], ["FSP", 4, 8, 23, 3], ["FSP", 4, 12, 24, 3], ["RE", 4, [0, 4, 8, 12, 1, 5, 9, 13, 2, 6, 10, 14, 3, 7, 11, 15]], ["CA", 3, 4, 11], ["CHR", 2, "shared", [3]], ["CA", 3, 4, 14], ["CHR", 1, "shared", [4]], ["CA", 2, 5, 14], ["CI", 1], ["FU", 12, [0, 1, 2, 3]], ["AN", 12, 0, 5], ["FU", 12, [1, 2, 3, 4]], ["AN", 12, 1, 4], ["FU", 12, [2, 3, 4, 5]], ["AN", 12, 2, 6], ["FU", 10, [0, 1, 2, 3]], ["SP", 10, 0, 2, [1], 1], ["AN", 10, 1, 2], ["FFSP", 10, 0, [4, 3, 2, 1], 1, 1], ["AN", 10, 1, 6], ["FU", 8, [0, 1, 2, 3]], ["SP", 8, 0, 1, [1], 1], ["AN", 8, 1, 2], ["FFSP", 8, 0, [4, 3, 2, 1], 1, 1], ["AN", 8, 1, 6], ["FU", 6, [0, 1, 2, 3]], ["AN", 6, 0, 5], ["FU", 6, [1, 2, 3, 4]], ["AN", 6, 1, 4], ["FU", 6, [2, 3, 4, 5]], ["AN", 6, 2, 6], ["FU", 4, [0, 1, 2, 3]], ["SP", 4, 0, 9, [1], 1], ["AN", 4, 1, 2], ["FFSP", 4, 0, [24, 23, 22, 21], 1, 1], ["AN", 4, 1, 6], ["FU", 2, [0, 1, 2, 3]], ["SP", 2, 0, 9, [1], 1], ["AN", 2, 1, 2], ["FFSP", 2, 0, [24, 23, 22, 21], 1, 1], ["AN", 2, 1, 6], ["PR", 5, 0, "auto_unroll_max_step$64"], ["PR", 11, 0, "auto_unroll_max_step$0"]]]], "r": [[4.79273e-06], 0, 2.13887, 1607392442], "v": "v0.3"}
{"i": [["[\"sepconv\", 2, 5, 5, 4, 3, 3, 3, \"float32\"]", "cuda -keys=cuda,gpu -max_num_threads=1024 -thread_warp_size=32", [-1, 16, 64, 49152, 65536, 1024, 8, 32]], [[], [["CHW", 6, "local"], ["SP", 6, 0, 2, [1, 2, 1, 1], 1], ["SP", 6, 5, 4, [1, 2, 1, 2], 1], ["SP", 6, 10, 3, [1, 1, 3, 1], 1], ["SP", 6, 15, 3, [1, 3, 1, 1], 1], ["SP", 6, 20, 3, [1, 1], 1], ["SP", 6, 23, 1, [1, 1], 1], ["SP", 6, 26, 1, [1, 1], 1], ["RE", 6, [0, 5, 10, 15, 1, 6, 11, 16, 2, 7, 12, 17, 20, 23, 26, 21, 24, 27, 3, 8, 13, 18, 22, 25, 28, 4, 9, 14, 19]], ["FSP", 7, 0, 1, 3], ["FSP", 7, 4, 2, 3], ["FSP", 7, 8, 3, 3], ["FSP", 7, 12, 4, 3], ["RE", 7, [0, 4, 8, 12, 1, 5, 9, 13, 2, 6, 10, 14, 3, 7, 11, 15]], ["CA", 6, 7, 11], ["CHR", 5, "shared", [6]], ["CA", 6, 7, 14], ["CHR", 4, "shared", [7]], ["CA", 5, 8, 14], ["CI", 4], ["CHW", 3, "local"], ["SP", 3, 0, 2, [1, 1, 2, 1], 1], ["SP", 3, 5, 3, [3, 1, 1, 1], 1], ["SP", 3, 10, 3, [1, 1, 3, 1], 1], ["SP", 3, 15, 3, [1, 1, 3, 1], 1], ["SP", 3, 20, 1, [1, 1], 1], ["SP", 3, 23, 3, [1, 3], 1], ["SP", 3, 26, 3, [1, 3], 1], ["RE", 3, [0, 5, 10, 15, 1, 6, 11, 16, 2, 7, 12, 17, 20, 23, 26, 21, 24, 27, 3, 8, 13, 18, 22, 25, 28, 4, 9, 14, 19]], ["FSP", 4, 0, 21, 3], ["FSP", 4, 4, 22, 3], ["FSP", 4, 8, 23, 3], ["FSP", 4, 12, 24, 3], ["RE", 4, [0, 4, 8, 12, 1, 5, 9, 13, 2, 6, 10, 14, 3, 7, 11, 15]], ["CA", 3, 4, 11], ["CHR", 2, "shared", [3]], ["CA", 3, 4, 14], ["CHR", 1, "shared", [4]], ["CA", 2, 5, 14], ["CI", 1], ["FU", 12, [0, 1, 2, 3]], ["AN", 12, 0, 5], ["FU", 12, [1, 2, 3, 4]], ["AN", 12, 1, 4], ["FU", 12, [2, 3, 4, 5]], ["AN", 12, 2, 6], ["FU", 10, [0, 1, 2, 3]], ["SP", 10, 0, 2, [2], 1], ["AN", 10, 1, 2], ["FFSP", 10, 0, [4, 3, 2, 1], 1, 1], ["AN", 10, 1, 6], ["FU", 8, [0, 1, 2, 3]], ["SP", 8, 0, 1, [1], 1], ["AN", 8, 1, 2], ["FFSP", 8, 0, [4, 3, 2, 1], 1, 1], ["AN", 8, 1, 6], ["FU", 6, [0, 1, 2, 3]], ["AN", 6, 0, 5], ["FU", 6, [1, 2, 3, 4]], ["AN", 6, 1, 4], ["FU", 6, [2, 3, 4, 5]], ["AN", 6, 2, 6], ["FU", 4, [0, 1, 2, 3]], ["SP", 4, 0, 9, [1], 1], ["AN", 4, 1, 2], ["FFSP", 4, 0, [24, 23, 22, 21], 1, 1], ["AN", 4, 1, 6], ["FU", 2, [0, 1, 2, 3]], ["SP", 2, 0, 9, [3], 1], ["AN", 2, 1, 2], ["FFSP", 2, 0, [24, 23, 22, 21], 1, 1], ["AN", 2, 1, 6], ["PR", 5, 0, "auto_unroll_max_step$64"], ["PR", 11, 0, "auto_unroll_max_step$0"]]]], "r": [[6.43487e-06], 0, 1.8805, 1607392443], "v": "v0.3"}
{"i": [["[\"sepconv\", 2, 5, 5, 4, 3, 3, 3, \"float32\"]", "cuda -keys=cuda,gpu -max_num_threads=1024 -thread_warp_size=32", [-1, 16, 64, 49152, 65536, 1024, 8, 32]], [[], [["CHW", 6, "local"], ["SP", 6, 0, 2, [1, 2, 1, 1], 1], ["SP", 6, 5, 4, [1, 2, 1, 2], 1], ["SP", 6, 10, 3, [1, 3, 1, 1], 1], ["SP", 6, 15, 3, [1, 3, 1, 1], 1], ["SP", 6, 20, 3, [1, 1], 1], ["SP", 6, 23, 1, [1, 1], 1], ["SP", 6, 26, 1, [1, 1], 1], ["RE", 6, [0, 5, 10, 15, 1, 6, 11, 16, 2, 7, 12, 17, 20, 23, 26, 21, 24, 27, 3, 8, 13, 18, 22, 25, 28, 4, 9, 14, 19]], ["FSP", 7, 0, 1, 3], ["FSP", 7, 4, 2, 3], ["FSP", 7, 8, 3, 3], ["FSP", 7, 12, 4, 3], ["RE", 7, [0, 4, 8, 12, 1, 5, 9, 13, 2, 6, 10, 14, 3, 7, 11, 15]], ["CA", 6, 7, 11], ["CHR", 5, "shared", [6]], ["CA", 6, 7, 14], ["CHR", 4, "shared", [7]], ["CA", 5, 8, 14], ["CI", 4], ["CHW", 3, "local"], ["SP", 3, 0, 2, [1, 2, 1, 1], 1], ["SP", 3, 5, 3, [1, 3, 1, 1], 1], ["SP", 3, 10, 3, [1, 3, 1, 1], 1], ["SP", 3, 15, 3, [1, 3, 1, 1], 1], ["SP", 3, 20, 1, [1, 1], 1], ["SP", 3, 23, 3, [1, 1], 1], ["SP", 3, 26, 3, [1, 3], 1], ["RE", 3, [0, 5, 10, 15, 1, 6, 11, 16, 2, 7, 12, 17, 20, 23, 26, 21, 24, 27, 3, 8, 13, 18, 22, 25, 28, 4, 9, 14, 19]], ["FSP", 4, 0, 21, 3], ["FSP", 4, 4, 22, 3], ["FSP", 4, 8, 23, 3], ["FSP", 4, 12, 24, 3], ["RE", 4, [0, 4, 8, 12, 1, 5, 9, 13, 2, 6, 10, 14, 3, 7, 11, 15]], ["CA", 3, 4, 11], ["CHR", 2, "shared", [3]], ["CA", 3, 4, 14], ["CHR", 1, "shared", [4]], ["CA", 2, 5, 14], ["CI", 1], ["FU", 12, [0, 1, 2, 3]], ["AN", 12, 0, 5], ["FU", 12, [1, 2, 3, 4]], ["AN", 12, 1, 4], ["FU", 12, [2, 3, 4, 5]], ["AN", 12, 2, 6], ["FU", 10, [0, 1, 2, 3]], ["SP", 10, 0, 2, [2], 1], ["AN", 10, 1, 2], ["FFSP", 10, 0, [4, 3, 2, 1], 1, 1], ["AN", 10, 1, 6], ["FU", 8, [0, 1, 2, 3]], ["SP", 8, 0, 1, [1], 1], ["AN", 8, 1, 2], ["FFSP", 8, 0, [4, 3, 2, 1], 1, 1], ["AN", 8, 1, 6], ["FU", 6, [0, 1, 2, 3]], ["AN", 6, 0, 5], ["FU", 6, [1, 2, 3, 4]], ["AN", 6, 1, 4], ["FU", 6, [2, 3, 4, 5]], ["AN", 6, 2, 6], ["FU", 4, [0, 1, 2, 3]], ["SP", 4, 0, 9, [1], 1], ["AN", 4, 1, 2], ["FFSP", 4, 0, [24, 23, 22, 21], 1, 1], ["AN", 4, 1, 6], ["FU", 2, [0, 1, 2, 3]], ["SP", 2, 0, 9, [1], 1], ["AN", 2, 1, 2], ["FFSP", 2, 0, [24, 23, 22, 21], 1, 1], ["AN", 2, 1, 6], ["PR", 5, 0, "auto_unroll_max_step$64"], ["PR", 11, 0, "auto_unroll_max_step$0"]]]], "r": [[4.94593e-06], 0, 2.0037, 1607392444], "v": "v0.3"}
